,wine_name,wine_winery,wine_country,wine_region,wine_year,wine_type,wine_price,wine_alcohol,wine_description,wine_thumb,wine_url,wine_seller
0,Filet Noir trocken,Weingut Metzger,Deutschland,Pfalz,2019,red,10.9,14.5," In der Nase hat der dunkel gefärbte 2019 Filet Noir intensive Aromen von Cassis und Pflaumen ergänzt von gewürzigen Aromen von Pfeffer und Piment.Am Gaumen intensiver Auftakt, gefolgt von kraftvoller Struktur und erstaunlich reifen, weichen Gerbstoffen. Hier wieder die feine Pfefferwürze, ergänzt von etwas Schokolade und Kaffeepulver. Kraftvoll und intensiv bis in den langen Abgang hinein, er paßt perfekt zu dunklem Fleisch vom Grill oder aus dem Ofen.",/themes/Frontend/WeinDirektimport/frontend/_public/src/img/no-picture.jpg,https://www.wein-direktimport.de/weine/deutschland/pfalz/uli-metzger/4607/2019-filet-noir-trocken?c=362,1
2,Château Sansonnet Saint Emilion Grand Cru Classé,Château Sansonnet,Frankreich,Bordeaux,2019,red,39.0,13.5," Lisa Perrotti-Brown, Wine Advocate, Juni 2020: „Opaque garnet-purple in color, the 2019 Sansonnet comes skipping out of the glass with vibrant notes of Morello cherries, blueberry compote, mulberries and warm black plums plus hints of raspberry leaves, Sichuan pepper, cassia and cumin seed with a waft of tree bark. The full-bodied palate is packed with crunchy black and red fruits, framed by exquisitely ripe, rounded tannins and bold freshness, finishing very long and mineral laced. Beautiful!“ Vinum, Bordeaux Extra Primeur 2019, September 2020: „Superbe, umwerfend fruchtige Aromatik, Brombeere und Kirsche; voller Ansatz, dichter, fleischiger Bau, einmalig feinkörniges und doch saftiges Tannin, lange Finale; einmalige Präzision, zeitgemässe, gelungene Interpretation eines grossen Terroirs.“ Peter Moser, Falstaff Bordeaux Primeur 2019: „Tiefdunkles Rubingranat, opaker Kern, violette Reflexe, zarte Randaufhellung. Mit zarter Kräuterwürze unterlegte frische Beerenfrucht, tabakige Nuancen, zart nach Kirschen. Mittlere Komplexität, rotbeerige Nuancen, dezente Tannine, mineralisch, wirkt leichtfüßig, vielseitiger Speisenbegleiter.“",https://www.wein-direktimport.de/media/image/b0/48/2d/Sansonnet-2019-web_200x300.jpg,https://www.wein-direktimport.de/weine/frankreich/bordeaux-saint-emilion-grand-cru-classe/chateau-sansonnet/4457/2019-chateau-sansonnet-saint-emilion-grand-cru-classe?c=362,1
3,"Amarone della Valpolicella DOC ""Pietro dal Cero""",Cà dei Frati,Italien,Lombardei,2015,red,45.0,16.0," Bereits das dunkle, fast schwarze Rubinrot des Weines kündigt ein Feuerwerk der Aromen an. In der Nase und am Gaumen hat er eine üppige Frucht, Aromen unter anderem von feinherben Schattenmorellen, Rosenblüten, eingelegten Früchten, Schokolade und Kaffee. Etwas Sternais und Minze sorgen für blumige Nuancen und große Finesse. Der Wein ist kraftvoll, er ist dicht und harmonisch, feine balsamische Würze rundet den grandiosen Geschmackseindruck perfekt ab.",https://www.wein-direktimport.de/media/image/e7/4f/ee/2015-AmaroneZIP_200x300.jpg,https://www.wein-direktimport.de/weine/italien/lombardei/ca-dei-frati/4546/2015-amarone-della-valpolicella-doc-pietro-dal-cero?c=362,1
4,Ronchedone Rosso Benaco Besciano IGT 375 ml,Cà dei Frati,Italien,Lombardei,2019,red,10.5,14.0," Der 2019 Ronchedone hat eine würzige, intensiv fruchtige Nase mit Aromen unter anderem von reifen Kirschen, Preiselbeeren, Cranberrys, Brombeeren und Hagebutte.Am Gaumen ist er sehr saftig, druckvoll und fordernd mit intensiven Fruchtaromen. Die gut eingebundene, erfrischende Säure und das präsente, aber reife und samtige Tanin machen den Genuß perfekt.",https://www.wein-direktimport.de/media/image/d0/a3/7e/Etikett-2019-ronchedone_200x300.jpg,https://www.wein-direktimport.de/weine/italien/lombardei/ca-dei-frati/4545/2019-ronchedone-rosso-benaco-besciano-igt-375-ml?c=362,1
5,Côtes du Rhône Villages 'Terre d'Argile',Domaine de la Janasse,Frankreich,Rhône,2020,red,16.5,14.5," Was für ein wunderbarer Korken! Länge 54 mm, aus einem Stück, das ist Grand Cru Niveau. Der Duft ist herrlich, dezent Zedernholz, etwas Portwein, warm und zart, ein Tick Muskatnuß, und das war erst der Korken. Leise gluckert der kirschrote 2020 Côtes du Rhône Villages 'Terre d'Argile' ins Glas, rubinrote Reflexe deuten auf dezente Reife hin. Die Nase ist frisch, hier präsente Aromen von Süßkirsche, Brombeere, Cassis, ganz klassisch Côtes du Rhône. Dazu noch Heidelbeere, Sauerkirsche, nach ein wenig Luftkontakt Pflaume, Thymian, weißer Pfeffer, Eukalyptus, Süßholz, Tapenade und nasser Stein. Würzig, aber nicht zu dick, das riecht so wunderbar „old school“, wie es vor 25 Jahren bei jedem guten Côtes du Rhône der Fall war.Am Gaumen startet der 2020 Terre d’Argile würzig, aber nicht marmeladig dick, hier setzen sich Mourvèdre und Syrah perfekt in Szene und sorgen für die elegante, anregende Struktur, ergänzt von kühler Mineralik. Mürbe, sanfte Gerbstoffe und die reife Säure ergänzen die harmonische Struktur perfekt. Das ist ein wunderbarer Wein, unglaublich trinkig, sehr fein als Solist, aber auch perfekt zur mediterranen Gemüseküche oder Fleisch vom Grill.",https://www.wein-direktimport.de/media/image/54/2f/3f/Terre-d-Argile-ZIP_200x300.jpg,https://www.wein-direktimport.de/weine/frankreich/suedliche-rhone/domaine-de-la-janasse/4481/2020-cotes-du-rhone-villages-terre-d-argile?c=362,1
6,Côtes du Rhône rouge,Domaine de la Janasse,Frankreich,Rhône,2020,red,9.95,14.5," Der 2020 Côtes du Rhône Rouge entwickelt nach längerem Luftkontakt eine wunderbare, intensive Aromatik. Deutlich sind die frischen Aromen von reifen Brombeeren und Sauerkirschen zu erkennen, gefolgt von zartem Süßmandelaroma, Hagebutte, Rauch und etwas Süßholz. Dazu kommt noch eine Prise Nelke, Leder und weißer Pfeffer.Am Gaumen ist der Wein frisch, saftig und rollt geschmeidig über die Zunge Richtung Rachen. Die Gerbstoffe sind frisch und haben eine seidige Textur, die Fruchtsäure ist präsent aber harmonisch, ein ganz feiner süßer Kern schließt den ersten Eindruck perfekt ab.",https://www.wein-direktimport.de/media/image/48/fe/ed/CdR-Rouge-ZIPBj6WHWpEgFOy3_200x300.jpg,https://www.wein-direktimport.de/weine/frankreich/suedliche-rhone/domaine-de-la-janasse/4482/2020-cotes-du-rhone-rouge?c=362,1
7,Terre de Bussière IGP,Domaine de la Janasse,Frankreich,Rhône,2019,red,9.95,14.5," Beim 2019 Terre de Bussière gibt es die gewohnt perfekte Kombination aus weicher, saftig-frischer Merlotfrucht mit der lebhaft-würzigen Frucht des Syrah. In der Nase viel dunkle Frucht, reife Kirsche, schwarze Johannisbeere und Schokolade, im Hintergrund etwas Kaffee und Herbes de Provence. Am Gaumen ist er sehr harmonisch, Säure und Gerbstoff sind perfekt dosiert und in die warme, weiche Frucht integriert. Ein herrlicher Gaumenschmeichler mit Niveau.Nicht nur zur mediterranen Küche ein Genuß, auch solo macht er eine gute Figur.",https://www.wein-direktimport.de/media/image/2d/e7/80/Terre-Bussiere-ZIPEqHzCN9cYFJCI_200x300.jpg,https://www.wein-direktimport.de/weine/frankreich/suedliche-rhone/domaine-de-la-janasse/4483/2019-terre-de-bussiere-igp?c=362,1
8,Châteauneuf-du-Pape Rouge,Domaine de la Janasse,Frankreich,Rhône,2019,red,39.5,15.0," Die wunderbare dunkle Farbe des 2019 Chateauneuf du Pape ist schon sehr verlockend, die Nase mit ausgeprägten Aromen von reifen Brombeeren, roten Johannisbeeren, Tapenade, reifen Pflaumen und Süßkirschen, ergänzt von Veilchenduft, zieht einen vollständig in den Bann. Am Gaumen mit seidig-kraftvollem Auftakt und überraschender Eleganz. Die wunderbar harmonische Struktur, kombiniert mit seidigen Gerbstoffen, der saftigen Frucht und feinen, leicht salziger Mineralik gehört mit zum Besten, was diese Region an Weinen hervorbringt.",https://www.wein-direktimport.de/media/image/fc/03/a5/Chat-9-Pape-Basis-ZIP_200x300.jpg,https://www.wein-direktimport.de/weine/frankreich/suedliche-rhone/domaine-de-la-janasse/4480/2019-chateauneuf-du-pape-rouge?c=362,1
9,"Châteauneuf-du-Pape rouge ""Cuvée Vieilles Vignes""",Domaine de la Janasse,Frankreich,Rhône,2019,red,88.0,15.5,,https://www.wein-direktimport.de/media/image/e3/71/37/Chat-9-Pape-Vieille-Vigne-ZIP_200x300.jpg,https://www.wein-direktimport.de/weine/frankreich/suedliche-rhone/domaine-de-la-janasse/3235/2019-chateauneuf-du-pape-rouge-cuvee-vieilles-vignes?c=362,1
10,Black Print,Markus Schneider,Deutschland,Pfalz,2020,red,15.9,14.0," Der 2020 Black Print ist tiefdunkel mit fast schwarzem Kern und intensiven violetten Reflexen, in der Nase hat der Black Print deutliche Aromen von Süßkirschen, Brombeeren, schwarze Johannisbeeren, dazu weitere dunkle Beeren, er ist wunderbar frisch und hat eine perfekte Struktur.Am Gaumen ist er saftig, frisch, zupackend, dicht und würzig. Bei aller Konzentration bleibt der Wein überraschend elegant, seidige, reife Tanine und die reife mittlere Fruchtsäure machen in bereits jetzt zu einem unglaublich verführerischen Rotwein.",https://www.wein-direktimport.de/media/image/77/ce/4c/Black-Print-ZIP_200x300.jpg,https://www.wein-direktimport.de/weine/deutschland/pfalz/weingut-markus-schneider/4540/2020-black-print?c=362,1
11,Schwarzer trocken,Weingut Metzger,Deutschland,Pfalz,2019,red,10.9,14.5," In der Nase hat der dunkel gefärbte 2019 Schwarzer intensive Aromen von Cassis und Pflaumen ergänzt von gewürzigen Aromen von Pfeffer und Piment.Am Gaumen intensiver Auftakt, gefolgt von kraftvoller Struktur und erstaunlich reifen, weichen Gerbstoffen. Hier wieder die feine Pfefferwürze, ergänzt von etwas Schokolade und Kaffeepulver. Kraftvoll und intensiv bis in den langen Abgang hinein, er paßt perfekt zu dunklem Fleisch vom Grill oder aus dem Ofen.  ",https://www.wein-direktimport.de/media/image/b2/5d/bc/2017-Schwarzer-ZIP_200x300.jpg,https://www.wein-direktimport.de/weine/deutschland/pfalz/uli-metzger/4536/2019-schwarzer-trocken?c=362,1
12,Dolomiti Rosso 'Réserve del Conte',Manincor,Italien,Südtirol/Alto Adige,2019,red,16.9,13.5," In der Nase ist der 2019 Réserve del Conte betont fruchtig, Cassis-, Heidel-, Brombeer- und Himbeeraroma sind sehr präsent, dazu kommt etwas Süßholz und frisch gemahlener weißer und schwarzer Pfeffer. Am Gaumen startet der Wein würzig-samtig, mit saftiger, leicht gereifter Frucht und präsenten, aber betont feinkörnigen Gerbstoffen. Alles zusammen sorgt für einen ausgesprochen harmonischen Trinkfluß. Falstaff Weinguide Südtirol 2021/22: „Satt funkelndes Rubin mit schimmerndem Rand. Erst etwas verhalten, öffnet sich dann mit Noten nach reifen Himbeeren, Brombeerkonfit, feines Zedernholz, Brotkruste, Mandeln und Bergamotte im Nachhall. Zieht saftig über die Zunge, geradlinig in Ansatz und Verlauf, gut integriertes griffiges Tannin, mit sattem Fruchtschmelz unterlegt, betont langer Ausklang, feingliedriger Trinkfluss.“   ",https://www.wein-direktimport.de/media/image/5b/54/e1/Reserve-Conte-ZIP_200x300.jpg,https://www.wein-direktimport.de/weine/italien/suedtirol/manincor/4492/2019-dolomiti-rosso-reserve-del-conte?c=362,1
13,Petresco IGT Toscana,Podere Le Cinciole,Italien,Toscana,2017,red,49.5,14.5," Antonio Galloni, Vinous, September 2021: „The 2017 Petresco is a stunning, utterly captivating wine. In a vintage that produced so many rich, opulent reds, Petresco is vertical in build and endowed with tremendous energy. Black cherry, spice, leather, tobacco, licorice and dried flowers open with a bit of coaxing. All the elements are so well balanced. The purity of the fruit is breathtaking. What a wine!“",https://www.wein-direktimport.de/media/image/2c/bd/2a/Petrosco-2017-ZIP_200x300.jpg,https://www.wein-direktimport.de/weine/italien/toskana/podere-le-cinciole/4341/2017-petresco-igt-toscana?c=362,1
14,Chianti Classico DOCg,Podere Le Cinciole,Italien,Toscana,2018,red,16.9,14.5," Antonio Galloni, Vinous, September 2021: „The 2018 Chianti Classico is a wine of magnificent purity and class. Lavender, sage, tobacco and cedar open first, leading to a core of dark red/purplish fruit. Savory and earthy, with terrific persistence, the 2018 has so much going on. Readers will find a deep, layered Chianti Classico full of character. The 2018 will benefit from a few years in bottle, as it is a bit tight at this stage.“",https://www.wein-direktimport.de/media/image/75/e6/a9/Chianti-Cinciole-2018-ZIP_200x300.jpg,https://www.wein-direktimport.de/weine/italien/toskana/podere-le-cinciole/4340/2018-chianti-classico-docg?c=362,1
15,Chianti Classico Gran Selecione Aluigi,Podere Le Cinciole,Italien,Toscana,2016,red,36.0,14.5," Antonio Galloni, Vinous, September 2021: „The 2016 Chianti Classico Gran Selezione Aluigi Campo ai Peri is fabulous. Bright, vibrant and intensely aromatic, the 2016 is total seduction right out of the glass. Intense floral/spiced aromatics, red/purplish berry fruit, spice, tobacco and mocha all race out of the glass in a wine that brilliantly marries power with finesse. The Aluigi is a Gran Selezione for the first time in 2016. It's quite simply one of the finest wines I have tasted from Le Cinciole.“",https://www.wein-direktimport.de/media/image/d5/40/15/Aluigi-2016-ZIP_200x300.jpg,https://www.wein-direktimport.de/weine/italien/toskana/podere-le-cinciole/4343/2016-chianti-classico-gran-selecione-aluigi?c=362,1
16,Camalaione IGT Toscana,Podere Le Cinciole,Italien,Toscana,2016,red,38.0,14.5," Antonio Galloni, Vinous, September 2020: „The 2016 Camalaione is a worthy follow up to the 2015. For Camalaione, proprietors Luca Orsini and Valeria Viganò blend Cabernet Sauvignon with Syrah and Merlot, an approach that works so well here.The 2016 is wonderfully alluring, even if it is very much tightly wound in the early going. Inky dark fruit, spice, new leather, licorice, menthol and dried herbs emerge with a bit of time in the glass. Silky and sleek, with mid-weight structure, Camalaione is absolutely gorgeous in 2016.“",https://www.wein-direktimport.de/media/image/db/3d/e9/Camalaione-2016-ZIP_200x300.jpg,https://www.wein-direktimport.de/weine/italien/toskana/podere-le-cinciole/4344/2016-camalaione-igt-toscana?c=362,1
17,Petresco IGT Toscana Magnum,Podere Le Cinciole,Italien,Toscana,2017,red,108.0,14.5," Antonio Galloni, Vinous, September 2021: „The 2017 Petresco is a stunning, utterly captivating wine. In a vintage that produced so many rich, opulent reds, Petresco is vertical in build and endowed with tremendous energy. Black cherry, spice, leather, tobacco, licorice and dried flowers open with a bit of coaxing. All the elements are so well balanced. The purity of the fruit is breathtaking. What a wine!“",https://www.wein-direktimport.de/media/image/43/67/06/Petrosco-2017-Magnum-ZIP_200x300.jpg,https://www.wein-direktimport.de/alle-weine/typ/magnum-doppelmagnum.../4342/2017-petresco-igt-toscana-magnum?c=362,1
18,Lagrein 'Rubatsch',Manincor,Italien,Südtirol/Alto Adige,2019,red,29.5,13.0," Der 2019 Lagrein Rubatsch ist schwarz wie die Nacht, allerdings mit purpurfarbenen Reflexen. In der Nase satte Aromen von reifen Pflaumen, reifen Süßkirschen, Brombeeren, Süßholz, Holunder, und etwas Karamel. Am Gaumen samtig weicher Auftakt, gefolgt von präsenten, aber reifen Gerbstoffen, bereits jetzt ist der Wein ausgesprochen harmonisch und präsent, sollte aber auf jeden Fall dekantiert und in großen Bordeauxgläsern serviert werden. Falstaff Weinguide Südtirol 2021/22: „Leuchtend klares Purpur mit granatroten Akzenten. Öffnet sich mit wohligen Noten von zartem Nougat, Süßholz, Minze und eingelegten Waldhimbeeren, dazu weißer Pfeffer und Kardamom. Spannt einen feinen Bogen, saftiger Schmelz, gut integriertes feinstoffiges Tannin, ausgewogen im Körper, zarte Cremigkeit, zeigt komplexes Spiel, hallt lange nach.“",https://www.wein-direktimport.de/media/image/e8/b5/9e/Rubatsch-Lagrein_200x300.jpg,https://www.wein-direktimport.de/weine/italien/suedtirol/manincor/4494/2019-lagrein-rubatsch?c=362,1
19,Vernatsch 'Der Keil',Manincor,Italien,Südtirol/Alto Adige,2020,red,15.9,13.0," Falstaff, Weinguide Südtirol 2021/22: „Brillantes, funkelndes klares Rubinrot. In der Nase fein gezeichnet, nach Himbeeren und satten Kirschen, unterlegt von sanft blumigen Nuancen. Am Gaumen sehr fruchtbetont mit klarem Fruchtkern und salzigem Nerv, spannt sich schön auf, leichtfüßig und elegant, im Nachhall knackig und grünwürzig.“",https://www.wein-direktimport.de/media/image/69/6b/49/Keil-Vernatsch-ZIP_200x300.jpg,https://www.wein-direktimport.de/weine/italien/suedtirol/manincor/4489/2020-vernatsch-der-keil?c=362,1
20,Primitivo Puglia 'I Muri',Farnese Vini srl,Italien,Abruzzen,2020,red,6.5,14.0," Der 2020 Primitivo 'I Muri' hat ein intensives Rubinrot mit violetten Reflexen. In der Nase ist er klar und frisch, mit Aromen von Süßkirsche, Blaubeere, Brombeere, etwas Schokolade und roter Konfitüre.Am Gaumen frischer und saftiger Auftakt, gefolgt von feinen Taninen, sanfter Säure und harmonischer Struktur. Der Wein ist kein Riese, sondern ein wunderbarer, geschmacklich eher leichter Wein zum „wegsüppeln“. ",https://www.wein-direktimport.de/media/image/bf/68/38/I-Muri-PrimitivoZIP_200x300.jpg,https://www.wein-direktimport.de/weine/italien/apulien-und-abruzzen/farnese/4488/2020-primitivo-puglia-i-muri?c=362,1
21,Neropasso Rosso Veneto,Biscardo,Italien,Veneto,2019,red,8.5,13.5," Der 2019 Neropasso hat eine intensive, rubinrote Farbe. In der Nase würzig, mit Aromen von Süß- und Sauerkirschen, Pflaumenkompott, Heidel- und Brombeeren, ergänzt von etwas Bitterschokolade und Vanille.Am Gaumen seidiger Auftakt, intensive Aromatik, deutliche Süße und reife, sanfte Gerbstoffe. Perfekt zu vegetarischen Aufläufen mit Tomaten und Auberginen oder Braten vom Wild und Rind.",https://www.wein-direktimport.de/media/image/f8/95/39/Neropasso-ZIP_200x300.jpg,https://www.wein-direktimport.de/weine/italien/veneto/biscardo/4478/2019-neropasso-rosso-veneto?c=362,1
22,STEINSATZ Rotwein,Markus Schneider,Deutschland,Pfalz,2017,red,29.5,14.5,,https://www.wein-direktimport.de/media/image/aa/23/17/2017-Steinsatz-jpg_200x300.jpg,https://www.wein-direktimport.de/weine/deutschland/pfalz/weingut-markus-schneider/4471/2017-steinsatz-rotwein?c=362,1
23,Château Ferran Pessac-Léognan,Château Ferran,Frankreich,Bordeaux,2019,red,19.5,14.0," Der dunkelfarbene 2019 Château Ferran Rouge Pessac Léognan duftet wunderbar nach Cassis, Brombeere, Espressokaffee, dunkler Schokolade, Vanille, feiner Holzwürze und frischer Heidelbeere. Dazu ist er ätherisch mit einem Hauch Eukalyptus und dezenter Kräuterwürze.Am Gaumen saftiger Auftakt, ausgeprägte und frische Aromatik, gut eingebundene Gerbstoffe, reife weiche Säure, feine Würze. Die perfekte Struktur wird gekrönt von einer guten Dichte und Länge. Dekantieren Sie den Wein nach Möglichkeit eine Stunde vor dem Genuß. Lisa Perrotti-Brown, Wine Advocate, Juni 2020: „The deep garnet-purple colored 2019 Ferran comes bounding out of the glass with energetic notes of redcurrant jelly, black raspberries and crushed blackcurrants followed by sparks of bouquet garni, cinnamon stick and iron ore. The medium to full-bodied palate is chock-full of vibrant red and black fruits, framed by ripe, grainy tannins and tons of freshness, finishing on a lingering mineral note.“",https://www.wein-direktimport.de/media/image/a4/cc/af/2019-Rouge-ZIP_200x300.jpg,https://www.wein-direktimport.de/weine/frankreich/bordeaux-pessac-leognan/chateau-ferran/4458/2019-chateau-ferran-pessac-leognan?c=362,1
24,"Spätburgunder trocken ""Vom Kalkstein""",Weingut Metzger,Deutschland,Pfalz,2019,red,9.9,13.5," In der Nase hat der elegante Wein die typischen Aromen reifer Waldbeeren, etwas Pflaume, im Hintergrund feiner, würziger Nelkenduft, ein Hauch Leder und eine ganz leichte erdig-mineralische Note. Am Gaumen wird das Aromenspiel derzeit von jugendlichen, dennoch feinen Gerbstoffen, feiner Säure und einer mittelkräftigen Struktur perfekt begleitet. Herrlich zum Filet  oder Steak vom Rind oder Hirschkalb. Dekantieren nicht vergessen, etwa 60 Minuten.",https://www.wein-direktimport.de/media/image/e0/ec/d0/PN-KalksteinH24GRzflPKT30_200x300.jpg,https://www.wein-direktimport.de/weine/deutschland/pfalz/uli-metzger/4447/2019-spaetburgunder-trocken-vom-kalkstein?c=362,1
25,Petit Noir trocken,Weingut Metzger,Deutschland,Pfalz,2019,red,9.9,14.0,,https://www.wein-direktimport.de/media/image/09/66/44/Petit-Noir_200x300.jpg,https://www.wein-direktimport.de/weine/deutschland/pfalz/uli-metzger/4448/2019-petit-noir-trocken?c=362,1
26,Ronchedone Rosso Benaco Besciano IGT,Cà dei Frati,Italien,Lombardei,2019,red,16.95,14.0," Der 2019 Ronchedone hat eine würzige, intensiv fruchtige Nase mit Aromen unter anderem von reifen Kirschen, Preiselbeeren, Cranberrys, Brombeeren und Hagebutte.Am Gaumen ist er sehr saftig, druckvoll und fordernd mit intensiven Fruchtaromen. Die gut eingebundene, erfrischende Säure und das präsente, aber reife und samtige Tanin machen den Genuß perfekt.",https://www.wein-direktimport.de/media/image/55/6d/69/ronchedone-ZIP_200x300.jpg,https://www.wein-direktimport.de/weine/italien/lombardei/ca-dei-frati/4455/2019-ronchedone-rosso-benaco-besciano-igt?c=362,1
27,Les Vignes de Bila Haut Rouge,Domaine de Bila Haut,Frankreich,Roussillon,2020,red,8.3,14.0," Der 2020 Les Vignes de Bila Haut Rouge hat ein frisches rubinrot mit violetten Reflexen. In der Nase mit leicht rauchigen Aromen, begleitet von satten Schwarzkirsch-, Brombeer-, Himbeer- und Pflaumenaromen, dazu kommen milde Gewürze und eine feine Veilchenaromatik im Hintergrund.Am Gaumen ist er frisch, mit präsenten aber feinen Gerbstoffen, zupackend und würzig. Es ist ein wunderbarer Wein zu leichten Grilladen und Salami mit Knoblauch.",https://www.wein-direktimport.de/media/image/e2/64/3c/Bila-Haut-rouge-ZIP_200x300.jpg,https://www.wein-direktimport.de/weine/frankreich/roussillon/domaine-de-bila-haut/4452/2020-les-vignes-de-bila-haut-rouge?c=362,1
28,"L'esquerda, Côtes du Roussillon Villages Lesquerde",Domaine de Bila Haut,Frankreich,Roussillon,2017,red,15.9,15.5," Joe Czerwinski, wine advocate, April 2018: „The full-bodied 2017 Cotes du Roussillon Villages Lesquerde l'Esquerda is wonderfully lush, welcoming and supple. Loaded with black cherries and crushed stone, this seductive number adds a dusting of cocoa powder on the long, slightly warm finish.“",https://www.wein-direktimport.de/media/image/b5/b6/78/Lesquerda-ohne-Jahrgang-ZIP_200x300.jpg,https://www.wein-direktimport.de/weine/frankreich/roussillon/domaine-de-bila-haut/4450/2018-l-esquerda-cotes-du-roussillon-villages-lesquerde?c=362,1
29,Opus One,Opus One Winery,USA,Napa Valley,2018,red,330.0,14.0," Lisa Perrotti-Brown, Wine Advocate, Februar 2021: „Very deep garnet-purple in color, the 2018 Opus One soars out of the glass with bright, bold boysenberries, warm cassis and ripe, juicy black plums notes, plus emerging nuances of lilacs, oolong tea, cinnamon stick, tilled soil and black truffles. Medium to full-bodied, the palate is packed with tightly wound layers of crunchy black fruits, supported by firm, grainy tannins and fantastic freshness, finishing with lifted fruitiness and on a lingering mineral note.“ Antonio Galloni, Vinous, Januar 2021: „The 2018 Opus One is incredibly elegant and polished, right out of the bottle. Silky tannins and lifted, perfumed aromatics add to an impression of finesse that distinguishes the 2018 from some of the preceding vintages in a pretty big way. It will be interesting to see if the 2018 gains body with a bit of time in bottle. It is pretty rare for Opus One to be so approachable at this stage.“",/themes/Frontend/WeinDirektimport/frontend/_public/src/img/no-picture.jpg,https://www.wein-direktimport.de/weine/usa/kalifornien/opus-one-napa-valley/2419/2018-opus-one?c=362,1
30,Maya,Dalla Valle Vineyards,USA,Napa Valley,2018,red,590.0,15.5," Lisa Perrotti-Brown, Wine Advocate, Januar 2021: „The very deep garnet-purple colored 2018 Maya is shy and restrained to begin. With swirling, it begins to reveal beguiling notes of fragrant earth, lavender, garrigue and Sichuan pepper, giving way to a core of wild blueberries, boysenberries, black raspberries and black currants plus a hint of iron ore. The palate is full-bodied, revealing itself in slow-releasing layers of black and blue fruits with exhilarating earth and mineral sparks, framed by firm, beautifully ripe tannins and bold freshness, finishing on a persistent ferrous note. As cerebral as it is downright hedonic, this Maya is simply jaw-dropping.“ Antonio Galloni, Vinous, Januar 2021: „The 2018 Maya is stratospheric. Inky, deep and wonderfully layered, Maya is off the charts. Inky red/purplish fruit, cedar, licorice, spice, tobacco and mocha are some of the many notes that grace the 2018. The wine is young, but exceptional and vivid. Maya is usually much more forbidding at this stage, this is an incredibly refined vintage. The purity and delineation of the flavors is unreal. Moreover, the 2018 is a wine of extreme pleasure.“",/themes/Frontend/WeinDirektimport/frontend/_public/src/img/no-picture.jpg,https://www.wein-direktimport.de/weine/usa/kalifornien/dalla-valle-vineyards/4445/2018-maya?c=362,1
