,wine_name,wine_winery,wine_country,wine_region,wine_year,wine_type,wine_price,wine_alcohol,wine_description,wine_thumb,wine_url,wine_seller
685,Riesling Selection „Ried Pfaffenberg“,Weingut Emmerich Knoll,Österreich,Wachau,2017,white,38.0,13.5," Falstaff Weinguide 2018/19: „Helles Gelbgrün, Silberreflexe. Floraler Touch, ein Hauch von gelber Tropenfrucht, gelber Pfirsich, zarter Blütenhonig, kandierte Orangenzesten. Saftig, feine Fruchtsüße, finessenreiche Säurestruktur, mineralisch, zitroniger Touch im Nachhall, gute Länge, sicheres Entwicklungspotenzial.“",https://www.wein-direktimport.de/media/image/62/e0/95/2016-Riesling-SELECTION-Pfaffenberg_200x300.jpg,https://www.wein-direktimport.de/weine/oesterreich/wachau/weingut-emmerich-knoll/2231/2017-riesling-selection-ried-pfaffenberg?c=559,1
686,Chassagne-Montrachet Blanc 1er Cru Clos Saint Jean,Domaine Blain-Gagnard,Frankreich,Bourgogne,2017,white,89.0,13.0," Der 2017 Chassagne Montrachet 1er Cru Clos St. Jean verzaubert die Verkosternase mit feiner Mineralik, floralen Aromen, ergänzt vom Duft weißer Pfirsiche, Süßmandeln und Zitrusfrüchten.Am Gaumen ist der Wein klar, frisch, elegant, zupackend, mit deutlicher Mineralik die fast ein wenig salzig wirkt. Bereits jetzt ist der Wein sehr zugänglich, hat aber Potential für die kommenden 10 Jahre.",https://www.wein-direktimport.de/media/image/2e/b6/02/2017-Chass-Montra-1er-Cru-Clos-St-Jean_200x300.jpg,https://www.wein-direktimport.de/weine/frankreich/bourgogne/cote-d-or/domaine-blain-gagnard/2220/2017-chassagne-montrachet-blanc-1er-cru-clos-saint-jean?c=559,1
687,Chassagne-Montrachet Blanc 1er Cru Boudriotte,Domaine Blain-Gagnard,Frankreich,Bourgogne,2017,white,89.0,13.0,,https://www.wein-direktimport.de/media/image/4f/54/06/2017-Chass-Montra-1er-Cru-Boudriottes_200x300.jpg,https://www.wein-direktimport.de/weine/frankreich/bourgogne/cote-d-or/domaine-blain-gagnard/2221/2017-chassagne-montrachet-blanc-1er-cru-boudriotte?c=559,1
688,Riesling Smaragd „Ried Kellerberg“,Weingut Emmerich Knoll,Österreich,Wachau,2017,white,38.0,13.0," Falstaff Weinguide 2018/19: „Helles Gelbgrün, Silberreflexe. Feine Nuancen von Ananas und gelber Pfirsichfrucht, Mandarinenzesten, mineralischer Touch. Kraftvoll, saftig, feine weiße Apfelfrucht, lebendiger Säurebogen, zitroniger Touch, ein finessenreicher Speisenbegleiter.“",https://www.wein-direktimport.de/media/image/10/98/89/16050315_200x300.jpg,https://www.wein-direktimport.de/weine/oesterreich/wachau/weingut-emmerich-knoll/2230/2017-riesling-smaragd-ried-kellerberg?c=559,1
689,Riesling Smaragd „Ried Schütt“,Weingut Emmerich Knoll,Österreich,Wachau,2017,white,42.5,13.5," Falstaff Weinguide 2018/19: „Helles Gelbgrün, Silberreflexe. Reifer gelber Pfirsich, ein Hauch von Ananas und Blütenhonig, einladendes Bukett. Komplex, stoffig, weiße Steinobstnuancen, finessenreich strukturiert, wirkt ungemein leichtfüßig, feiner Zitrustouch im Abgang, bleibt gut haften, sicheres Reifepotenzial.“",https://www.wein-direktimport.de/media/image/42/4b/24/2016-Riesling-SMARAGD-Schuett59edbb5ec9da3_200x300.jpg,https://www.wein-direktimport.de/weine/oesterreich/wachau/weingut-emmerich-knoll/3421/2017-riesling-smaragd-ried-schuett?c=559,1
690,Riesling trocken Pettenthal GG Magnum,Weingut Kühling-Gillot,Deutschland,Rheinhessen,2017,white,101.0,12.5,,https://www.wein-direktimport.de/media/image/4c/ba/c3/2017-Pettenthal-GG_200x300.jpg,https://www.wein-direktimport.de/weine/deutschland/rheinhessen/weingut-kuehling-gillot/2113/2017-riesling-trocken-pettenthal-gg-magnum?c=559,1
691,Riesling trocken Pettenthal GG,Weingut Kühling-Gillot,Deutschland,Rheinhessen,2017,white,48.0,12.5,,https://www.wein-direktimport.de/media/image/4c/ba/c3/2017-Pettenthal-GG_200x300.jpg,https://www.wein-direktimport.de/weine/deutschland/rheinhessen/weingut-kuehling-gillot/2112/2017-riesling-trocken-pettenthal-gg?c=559,1
692,Riesling trocken Zellerweg Am Schwarzen Herrgott GG,Weingut Battenfeld-Spanier,Deutschland,Rheinhessen,2017,white,48.0,12.5,,https://www.wein-direktimport.de/media/image/d2/05/f9/Battenfeld-Herrgott-GG-2017_200x300.jpg,https://www.wein-direktimport.de/weine/deutschland/rheinhessen/weingut-battenfeld-spanier/2109/2017-riesling-trocken-zellerweg-am-schwarzen-herrgott-gg?c=559,1
693,Riesling trocken Hipping GG,Weingut Kühling-Gillot,Deutschland,Rheinhessen,2017,white,48.0,12.5,,https://www.wein-direktimport.de/media/image/98/24/76/2017-Hipping-GG_200x300.jpg,https://www.wein-direktimport.de/weine/deutschland/rheinhessen/weingut-kuehling-gillot/2114/2017-riesling-trocken-hipping-gg?c=559,1
694,Riesling trocken Zellerweg Am Schwarzen Herrgott GG Magnum,Weingut Battenfeld-Spanier,Deutschland,Rheinhessen,2017,white,101.0,12.5,,https://www.wein-direktimport.de/media/image/d2/05/f9/Battenfeld-Herrgott-GG-2017_200x300.jpg,https://www.wein-direktimport.de/weine/deutschland/rheinhessen/weingut-battenfeld-spanier/2110/2017-riesling-trocken-zellerweg-am-schwarzen-herrgott-gg-magnum?c=559,1
695,Riesling Spätlese Oberhäuser Brücke *Monopol*,Weingut Dönnhoff,Deutschland,Nahe,2017,white,26.0,8.0,,https://www.wein-direktimport.de/media/image/d9/0b/6c/Oberhaeuser-Bruecke-Riesling-Sp-tlese_200x300.jpg,https://www.wein-direktimport.de/weine/deutschland/nahe/weingut-doennhoff/2131/2017-riesling-spaetlese-oberhaeuser-bruecke-monopol?c=559,1
696,Riesling Juffer Sonnenuhr GG,Weingut Schloss Lieser,Deutschland,Mosel,2017,white,29.5,12.0," Stephan Reinhardt, wine advocate, Juni 2019: „The 2017 Brauneberger Juffer Sonnenuhr Riesling GG offers an intense yellow color and a correspondingly deep bouquet of ripe and concentrated fruits intertwined with fine and refreshing notes of crushed stones and a dash of lemon juice. Silky, lush and round on the palate, this is a tightly structured, powerful and persistent Juffer Sonnenuhr that is more masculine and strong than delicate. The finish is juicy, piquant and spicy, piercing the mucous membranes of the mouth. Tasted from a decanted bottle in March 2019.“",https://www.wein-direktimport.de/media/image/7a/0f/c9/Juffer-Sonnenuhr-GGiBGbMHu2oVrKs_200x300.jpg,https://www.wein-direktimport.de/weine/deutschland/mosel-und-saar/weingut-schloss-lieser/2118/2017-riesling-juffer-sonnenuhr-gg?c=559,1
697,Riesling trocken Jesuitengarten Forst GG,Weingut Reichsrat von Buhl,Deutschland,Pfalz,2017,white,49.0,12.5,,https://www.wein-direktimport.de/media/image/40/2e/d0/2016-Jesuitengarten-GG_200x300.jpg,https://www.wein-direktimport.de/weine/deutschland/pfalz/weingut-reichsrat-von-buhl/2107/2016-riesling-trocken-jesuitengarten-forst-gg?c=559,1
698,Blanc de Blanc Brut -A- 100% Chardonnay,Weingut Metzger,Deutschland,Pfalz,,white,13.9,12.5," In der Nase mit feinen Aromen von reifen gelben Äpfeln, Birnen, etwas Süßmandel und ofenfrischen Brioches, dezent Hefe.Am Gaumen überraschend eleganter Auftakt. Der Blanc de Blanc Brut ist wunderbar fein, fast zart, mit cremiger Struktur und feiner, dennoch zupackender Frucht mit feiner Perlage. Die reife Säure ist gut eingebettet und recht zurückhaltend, der Abgang ist harmonisch und lang.    Perfekt gemacht für Fans von feineren Sekten.",https://www.wein-direktimport.de/media/image/7b/f4/cb/CH-Bl-de-Bl-BRUTdBrQQjlHKzNLL_200x300.jpg,https://www.wein-direktimport.de/weine/deutschland/pfalz/uli-metzger/1976/blanc-de-blanc-brut-a-100-chardonnay?c=559,1
699,Chardonnay Beerenauslese SW 375 ml,Weingut Velich,Österreich,Burgenland,2013,white,15.9,15.0," Hellfarbener Bernsteinton. In der Nase intensive Botrytiswürze, zarte Dörrobstaromen, Marillenkonfit, am Gaumen elegant, gut integrierte Süße, zeigt bereits eine sehr gute Länge.",https://www.wein-direktimport.de/media/image/8d/71/20/2013-BA-SW_200x300.jpg,https://www.wein-direktimport.de/weine/oesterreich/burgenland/weingut-velich/2050/2013-chardonnay-beerenauslese-sw-375-ml?c=559,1
700,"Mercurey Blanc Premier Cru ""Les Champs Martin""",Domaine Lorenzon,Frankreich,Bourgogne,2016,white,46.0,13.0," William Kelley, wine advocate, Juli 2018: „The 2016 Mercurey 1er Cru Les Champs Martin is spectacular, a testament both to Lorenzon's talent and dedication and to the potential of this appellation's white wines. Unfurling in the glass with a vibrant bouquet of lemon oil, verbena, crisp apple and mango skin, it's full-bodied, multidimensional and expansive, with textural generosity and layering that belies its crisp nose, displaying superb concentration and length. Effortless and unforced, this wine is about as good as Mercurey blanc gets.“",https://www.wein-direktimport.de/media/image/84/ec/ac/2016-Champ-Martin-Mercurey-1er-Cru-blanc_200x300.jpg,https://www.wein-direktimport.de/weine/frankreich/bourgogne/cote-chalonnaise/domaine-lorenzon/1914/2016-mercurey-blanc-premier-cru-les-champs-martin?c=559,1
701,Riesling Auslese *** Goldkapsel Zeltinger Sonnenuhr 375 ml,Weingut Markus Molitor,Deutschland,Mosel,2015,white,44.9,7.5," Stephan Reinhardt, wine advocate, Februar 2017: ""The 2015 Riesling Zeltinger Sonnenuhr Auslese *** (Golden Capsule) is clear, fresh and concentrated on the nose nose where deep and smoky flavors of crushed stones are displayed, giving just a hint of the true potential of this wine. Round and seamless on the palate, with perfectly ripe but vital and fresh fruit, this has a gorgeous mineral raciness and tension. There is also a quiet stream of perfectly balanced and concentrated melting stones and very fine salts that flows over the palate. This is an exiting, very well structured and tightly woven Riesling legend that will still fascinate wine lovers in 50, 60, maybe 70 years. This is a laser beam of great Riesling, tight and concentrated but still not that open like the corresponding Wehlener.""",https://www.wein-direktimport.de/media/image/c1/8d/78/10020237_200x300.jpg,https://www.wein-direktimport.de/weine/deutschland/mosel-und-saar/weingut-markus-molitor/1874/2015-riesling-auslese-goldkapsel-zeltinger-sonnenuhr-375-ml?c=559,1
702,Riesling Auslese *** Goldkapsel Zeltinger Sonnenuhr,Weingut Markus Molitor,Deutschland,Mosel,2015,white,85.0,7.5," Stephan Reinhardt, Wine Advocate, Februar 2017: ""The 2015 Riesling Zeltinger Sonnenuhr Auslese *** (Golden Capsule) is clear, fresh and concentrated on the nose nose where deep and smoky flavors of crushed stones are displayed, giving just a hint of the true potential of this wine. Round and seamless on the palate, with perfectly ripe but vital and fresh fruit, this has a gorgeous mineral raciness and tension. There is also a quiet stream of perfectly balanced and concentrated melting stones and very fine salts that flows over the palate. This is an exiting, very well structured and tightly woven Riesling legend that will still fascinate wine lovers in 50, 60, maybe 70 years. This is a laser beam of great Riesling, tight and concentrated but still not that open like the corresponding Wehlener.""",https://www.wein-direktimport.de/media/image/c1/8d/78/10020237_200x300.jpg,https://www.wein-direktimport.de/weine/deutschland/mosel-und-saar/weingut-markus-molitor/3658/2015-riesling-auslese-goldkapsel-zeltinger-sonnenuhr?c=559,1
703,Riesling Spätlese Zeltinger Sonnenuhr Magnum,Weingut Markus Molitor,Deutschland,Mosel,2015,white,60.0,7.5," Stephan Reinhardt, wine advocate, März 2016: ""The 2014 Riesling Zeltinger Sonnenuhr Riesling Spätlese (White Capsule) displays ripe and intense yellow apple, as well as concentrated quince and apricot confiture on the nose. Rich and intense, concentrated, sweet and tart on the palate, this is a very elegant yet concentrated, round and fruity Spätlese that develops a stunning purity, finesse and elegance in the stimulatingly salty finish. This is a stunning Riesling with two faces at the moment: the one is ultra-ripe and reveals pink grapes and a bit of good botrytis, the other has the salinity, purity and delicacy of the Mosel Alte Reben and develops an enormously long finish. This is dry Riesling that should be reserved for the next decade. In case you love to drink it earlier, you should open the bottle a few days before and keep it cool. Then take your biggest glass and detect how intense, pure and persistently salty this Zeltlinger Sonnenuhr is."" ",/themes/Frontend/WeinDirektimport/frontend/_public/src/img/no-picture.jpg,https://www.wein-direktimport.de/weine/deutschland/mosel-und-saar/weingut-markus-molitor/1856/2015-riesling-spaetlese-zeltinger-sonnenuhr-magnum?c=559,1
704,Eiswein 'ICE WINE 375 ml,Liliac,Rumänien,Transsilvanien,2017,white,22.0,11.5," In der Nase feine Wiesenkräuter, etwas Steinobst und Lychee. Am Gaumen frisch und lebhaft, Ananasfrucht, feine exotische Aromen, etwas Honig.",https://www.wein-direktimport.de/media/image/5a/e2/33/ICE-WINE_200x300.jpg,https://www.wein-direktimport.de/weine/oesterreich/burgenland/weingut-kracher/1821/2017-eiswein-ice-wine-375-ml?c=559,1
705,Riesling Auslese *** trocken Zeltinger Sonnenuhr Magnum,Weingut Markus Molitor,Deutschland,Mosel,2015,white,160.0,12.5," Stephan Reinhardt, wine advocate, Februar 2017. ""From the oldest vines (120+ years), the 2015 Riesling Zeltlinger Sonnenuhr Auslese *** (White Capsule) opens with a very pure yet rich and intense bouquet of luxuriously ripe and intense fruits. Rich and opulent on the palate, still with a yeasty texture but great elegance and endless salinity, this is a powerful and intense Riesling with fine yet vital acidity, a very good mineral grip and a long finish. However, this wine needs at least 10 to 20 years to age and might deserve an even higher score then.""",https://www.wein-direktimport.de/media/image/2e/81/ba/2015-Zelt-Sonnen-Ausl-3-Sterne-tro_200x300.jpg,https://www.wein-direktimport.de/weine/deutschland/mosel-und-saar/weingut-markus-molitor/1741/2015-riesling-auslese-trocken-zeltinger-sonnenuhr-magnum?c=559,1
706,Riesling Spätlese Niederhäuser Hermannshöhle Magnum,Weingut Dönnhoff,Deutschland,Nahe,2016,white,59.0,11.0," Stephan Reinhardt, wine advocate, Februar 2018: „The 2016 Nahe Riesling Niederhäuser Hermannshöhle Spätlese is bright, fresh and coolish-piquant on the nose, with flinty and slightly reductive aromas. Lush and piquant on the palate, this is a generous, mouth-filling Spätlese with a long, piquant and spicy-mineral finish. The Hermannshöhle is more dense and rich on the palate, the Brücke more light, delicate and finessed.“",https://www.wein-direktimport.de/media/image/b9/4c/f4/Riesling-Spaetlese-Hermannshohle597f029c74672_200x300.jpg,https://www.wein-direktimport.de/weine/deutschland/nahe/weingut-doennhoff/1729/2016-riesling-spaetlese-niederhaeuser-hermannshoehle-magnum?c=559,1
707,Riesling trocken Frauenberg GG Doppelmagnum,Weingut Battenfeld-Spanier,Deutschland,Rheinhessen,2015,white,185.0,12.5," Stephan Reinhardt, wine advocate, August 2016: „The 2015 Nieder-Florsheim Frauenberg Riesling trocken GG offers a dusty, chalky/lemony, still slightly reductive but clear and complex nose, with ripe but precise fruit aromas. Very elegant on the silky textured palate, this is an intense and concentrated though medium-weighted, dry Riesling. It is vivacious with great finesse and a clear, chalky expression. The finish is enormous and full of tension. This is an impressive wine.“",https://www.wein-direktimport.de/media/image/6f/82/a6/10060405_200x300.jpg,https://www.wein-direktimport.de/weine/deutschland/rheinhessen/weingut-battenfeld-spanier/1693/2015-riesling-trocken-frauenberg-gg-doppelmagnum?c=559,1
708,"Riesling SL Spätlese trocken ""Helden""",Weingut Schloss Lieser,Deutschland,Mosel,2016,white,17.9,12.0," Spät im Niederberger Helden gelesenes, prachtvolles und gesundes Lesegut mit reifer Säure. Was nicht heißen soll, sie wäre inexistent. Knapp 8 Gramm balgen sich mit der recht verhaltenen Süße von 6 Gramm darum, wer das Sagen hat. Wenn zwei sich streiten…Stoffige, dichte Nase, viel reife gelbe Früchte, dezent Mango, etwas Blutorange und über allem schwebt etwas weißer Pfeffer und die mineralische Würze vom Schieferboden. Diese wird am Gaumen von einer dezenten Salznote ergänzt. Hier kommt auch wieder die dichte, komplexe Frucht mit etwas Grapefruitwürze perfekt zur Geltung und die pikante, knackige Säure sorgt für lang anhaltende Frische.  Was für ein Wein! Kraftvoll und dennoch mit einer grandiosen Finesse. Grandios gemacht, ein toller Wein mit großer Feinheit und, entschuldigen Sie den altmodischen Ausdruck, Rasse.   Stephan Reinhardt, wine advocate, März 2018: „The 2016 Riesling Spätlese Trocken ""SL"" –Helden– displays intense, still yeasty but clear and well-concentrated fruit on the nose. Round, lush and elegant on the palate, this is an intense and juicy, well-structured and elegant dry Spätlese with charming fruit. Still young. Tasted March 2018.“",https://www.wein-direktimport.de/media/image/d9/54/e6/10020413_200x300.jpg,https://www.wein-direktimport.de/weine/deutschland/mosel-und-saar/weingut-schloss-lieser/1226/2016-riesling-sl-spaetlese-trocken-helden?c=559,1
709,Riesling Auslese ** fruchtsüß Bernkasteler Badstube Grüne Kapsel,Weingut Markus Molitor,Deutschland,Mosel,2015,white,38.0,8.0," Stephan reinhardt, wine advocate, April 2017: ""The 2015 Riesling Bernkasteler Badstube Auslese ** (Green Capsule) is clear, bright, fresh and flinty on the precise, cool and aromatic nose. The attack on the palate is fresh and piquant before the pure and crystalline texture with all its salts take over the regiment and carries this gorgeous, highly elegant and finessed Auslese into a very long and juicy, in fact endless finish. This is power mixed with purity, finesse and elegance. Great aging potential.""",https://www.wein-direktimport.de/media/image/e2/db/a4/badstube-auslese-Gruene-Kapsel-2015_200x300.jpg,https://www.wein-direktimport.de/weine/deutschland/mosel-und-saar/weingut-markus-molitor/1529/2015-riesling-auslese-fruchtsuess-bernkasteler-badstube-gruene-kapsel?c=559,1
710,Riesling trocken Forster Ungeheuer GG Magnum,Weingut Reichsrat von Buhl,Deutschland,Pfalz,2016,white,69.0,13.0,,https://www.wein-direktimport.de/media/image/14/9d/b7/10030218_200x300.jpg,https://www.wein-direktimport.de/weine/deutschland/pfalz/weingut-reichsrat-von-buhl/3666/2016-riesling-trocken-forster-ungeheuer-gg-magnum?c=559,1
711,Riesling trocken Hipping GG Magnum,Weingut Kühling-Gillot,Deutschland,Rheinhessen,2016,white,95.0,12.5,,https://www.wein-direktimport.de/media/image/0d/46/ea/10060333_200x300.jpg,https://www.wein-direktimport.de/weine/deutschland/rheinhessen/weingut-kuehling-gillot/1485/2016-riesling-trocken-hipping-gg-magnum?c=559,1
712,Riesling trocken Pettenthal GG Doppelmagnum,Weingut Kühling-Gillot,Deutschland,Rheinhessen,2016,white,192.0,12.5,,https://www.wein-direktimport.de/media/image/5f/ce/3f/O-J-Pettenthal-GG_200x300.jpg,https://www.wein-direktimport.de/weine/deutschland/rheinhessen/weingut-kuehling-gillot/1483/2016-riesling-trocken-pettenthal-gg-doppelmagnum?c=559,1
713,Riesling trocken Forster Kirchenstück GG Magnum,Weingut Reichsrat von Buhl,Deutschland,Pfalz,2015,white,163.0,13.0," Dirk Würtz, wuertz-wein.de, August 2017: „…ein Klassiker. Ein Stück Weinkultur hierzulande. Diese Art von vornehmer Zurückhaltung, Distinguiertheit und dennoch völlig unspektakulärer Präsenz ist einfach herrlich. Ein 2015er, der im Reigen der ganz jungen Weine hier steht, wie zementiert. So muss das sein! Ähnlich und doch ganz anders das 2015 KIRCHENSTÜCK von von Buhl. Deutlich kräftiger in der Säure mit enorm viel Zug. Kann man direkt jetzt trinken, was ganz sicher keine schlechte Entscheidung wäre. Mund- und abendfüllend.“",https://www.wein-direktimport.de/media/image/bb/17/84/10030222_200x300.jpg,https://www.wein-direktimport.de/weine/deutschland/pfalz/weingut-reichsrat-von-buhl/177/2015-riesling-trocken-forster-kirchenstueck-gg-magnum?c=559,1
714,Riesling Spätlese Oberhäuser Brücke *Monopol* Magnum,Weingut Dönnhoff,Deutschland,Nahe,2016,white,64.0,8.0,,https://www.wein-direktimport.de/media/image/c3/5f/cc/Oberhaeuser-Bruecke-MONOPOL-Leistenberg-Riesling-Spaetlese_200x300.jpg,https://www.wein-direktimport.de/weine/deutschland/nahe/weingut-doennhoff/2643/2016-riesling-spaetlese-oberhaeuser-bruecke-monopol-magnum?c=559,1
715,Riesling trocken Frauenberg GG,Weingut Battenfeld-Spanier,Deutschland,Rheinhessen,2015,white,42.0,12.5,,https://www.wein-direktimport.de/media/image/6f/82/a6/10060405_200x300.jpg,https://www.wein-direktimport.de/weine/deutschland/rheinhessen/weingut-battenfeld-spanier/350/2015-riesling-trocken-frauenberg-gg?c=559,1
716,"Chardonnay TBA Nr. 10 ""Nouvelle Vague"" 375 ml",Weingut Kracher,Österreich,Burgenland,2006,white,48.0,8.5,,https://www.wein-direktimport.de/media/image/d5/91/e8/2006_Nr10-Nouvelle-Vague_200x300.jpg,https://www.wein-direktimport.de/weine/oesterreich/burgenland/weingut-kracher/1029/2006-chardonnay-tba-nr.-10-nouvelle-vague-375-ml?c=559,1
717,Sämling Trockenbeerenauslese 375 ml,Weingut Velich,Österreich,Burgenland,2006,white,44.5,12.0," Peter Moser, Falstaff, Juni 2010: ""Kräftiges, mit Goldreflexen unterlegtes Bernsteingelb, noch nicht blank. Deutliche Mandarinennoten, viel Honig, aber auch florale Anklänge, saftige Steinobstfrucht, rassige Säurestruktur, zeigt noch erheblichen Babyspeck, tolle Länge, cremig und anhaltend, ein großes Zukunftsversprechen.""",https://www.wein-direktimport.de/media/image/6f/38/8c/Saemling5ae6d632a53ce_200x300.jpg,https://www.wein-direktimport.de/weine/oesterreich/burgenland/weingut-velich/1021/2006-saemling-trockenbeerenauslese-375-ml?c=559,1
718,Riesling Trockenbeerenauslese Niederhäuser Hermannshöhle 375 ml,Weingut Dönnhoff,Deutschland,Nahe,2010,white,395.0,8.0," David Schildknecht, wine advocate, Dezember 2011: „From berries selected out of the corresponding Auslese, Donnhoff's 2010 Niederhauser Hermannshohle Riesling Trockenbeerenauslese was intended to be Beerenauslese, given 180 Oechsle and 14 grams of acidity it was evident that he had a T.B.A. on his hands ? and what a one! High-toned, penetrating aromas of maraschino, marzipan, and pungent lemon rind usher in a creamily rich yet buoyant and enervating palate loaded with quince preserves and pear nectar; honey and caramel; maraschino and white raisin. Brightness of fresh lemon and depth of nut oils emerge in the finish, the sheer abundance of material present here serving to somehow guarantee a seamless yet fruitfully tense cohabitation of this elixir's acidic with its ennobled richness, its spine and vivacity with its creamy opulence. This ought to be worth following for a half century or more.“",/themes/Frontend/WeinDirektimport/frontend/_public/src/img/no-picture.jpg,https://www.wein-direktimport.de/weine/deutschland/nahe/weingut-doennhoff/128/2010-riesling-trockenbeerenauslese-niederhaeuser-hermannshoehle-375-ml?c=559,1
719,Chardonnay trocken Nonnengarten,Weingut K.-H. Milch,Deutschland,Rheinhessen,2016,white,18.5,13.5," Der Wein hat Holz, viel Holz. Im Mund und in der Nase. Dazu Vanille- und Moccaaromen. Ergänzt von frischer Säure und feiner Kräuterwürze,  die verhindern, daß der Gigant den Schwung verliert. Eine ordentliche Schippe Steine, sprich Mineralik sorgt für zusätzliche Spannung im Wein. Die weiche, ausladende Frucht mit deutlichen Aromen unter anderem reifer Äpfel, Birnen, Aprikosen, Trockenobst, Honig und Süßmandel kommt noch dazu. Gönnen Sie ihm Luft, Eine Stunde darf es sein, zu kalt servieren sollten Sie ihn nicht. 12 Grad sind passend, wenn der Wein wärmer wird, macht dies auch nichts. Und trinken Sie ihn zu Speisen, zu denen der Kopf „bitte Rotwein“ sagt.",/themes/Frontend/WeinDirektimport/frontend/_public/src/img/no-picture.jpg,https://www.wein-direktimport.de/weine/deutschland/rheinhessen/weingut-milch/379/2016-chardonnay-trocken-nonnengarten?c=559,1
720,Riesling Auslese *** trocken Zeltinger Sonnenuhr,Weingut Markus Molitor,Deutschland,Mosel,2015,white,78.0,12.5," Stephan Reinhardt, wine advocate, Februar 2017. ""From the oldest vines (120+ years), the 2015 Riesling Zeltlinger Sonnenuhr Auslese *** (White Capsule) opens with a very pure yet rich and intense bouquet of luxuriously ripe and intense fruits. Rich and opulent on the palate, still with a yeasty texture but great elegance and endless salinity, this is a powerful and intense Riesling with fine yet vital acidity, a very good mineral grip and a long finish. However, this wine needs at least 10 to 20 years to age and might deserve an even higher score then.""",https://www.wein-direktimport.de/media/image/2e/81/ba/2015-Zelt-Sonnen-Ausl-3-Sterne-tro_200x300.jpg,https://www.wein-direktimport.de/weine/deutschland/mosel-und-saar/weingut-markus-molitor/74/2015-riesling-auslese-trocken-zeltinger-sonnenuhr?c=559,1
721,Riesling Auslese Niederhäuser Hermannshöhle 'Goldkapsel',Weingut Dönnhoff,Deutschland,Nahe,2016,white,49.0,7.5,,https://www.wein-direktimport.de/media/image/47/6a/1e/Riesling-AUSLESE-GOLD-Niederhaeuser-Hermannshoehle5989959b104de_200x300.jpg,https://www.wein-direktimport.de/weine/deutschland/nahe/weingut-doennhoff/1403/2016-riesling-auslese-niederhaeuser-hermannshoehle-goldkapsel?c=559,1
