,wine_name,wine_winery,wine_country,wine_region,wine_year,wine_type,wine_price,wine_alcohol,wine_description,wine_thumb,wine_url,wine_seller
206,Chambolle-Musigny AC,Domaine Hudelot-Noëllat,Frankreich,Bourgogne,2018,red,58.0,13.0," William Kelley, Wine Advocate, Januar 2020: „Wafting from the glass with notes of cherries, raspberries, rose petals and orange rind, the 2018 Chambolle-Musigny Village is medium to full-bodied, supple and fleshy, with refined tannins, lively acids and a perfumed finish.“",https://www.wein-direktimport.de/media/image/93/d4/c2/Chambolles-Muss_200x300.jpg,https://www.wein-direktimport.de/weine/frankreich/bourgogne/cote-d-or/hudelot-noellat/3460/2018-chambolle-musigny-ac?c=362,1
207,Nuits St. Georges 'Les Bas du Combe',Domaine Hudelot-Noëllat,Frankreich,Bourgogne,2018,red,58.5,13.0," William Kelley, wine advocate, Januar 2020: „The 2018 Nuits-Saint-Georges Au Bas de Combe reveals a perfumed bouquet of raspberries, rose petals, orange rind and potpourri, complemented by rich soil tones and a deft framing of oak. On the palate, the wine is medium to full-bodied, supple and fleshy, with an open-knit core of ripe but succulent fruit. This is an especially elegant Nuits, concluding a lovely triumvirate of communal bottlings chez Hudelot-Noellat this year.“",https://www.wein-direktimport.de/media/image/a5/cb/35/Nuits-St-George-Bas-Combe_200x300.jpg,https://www.wein-direktimport.de/weine/frankreich/bourgogne/cote-d-or/hudelot-noellat/3464/2018-nuits-st.-georges-les-bas-du-combe?c=362,1
208,Sangiovese Rosso Toscana,Caparzo,Italien,Toscana,2019,red,5.95,13.0," Der 2019 Rosso Toskana duftet intensiv nach reifen Sauerkirschen und feinen Gewürzen. Im Glas schimmert er tief dunkel mit violetten Reflexen.Am Gaumen besticht der Wein durch die dichte und druckvolle Frucht und Aromen von roten Beeren, Röstnoten und etwas Kaffee. Die Harmonie und Frische sind ein Garant für viel Trinkspaß. Er ist sowohl ein perfekter Begleiter zu verschiedenen Fleischgerichten als auch solo ein toller Wein aus einem der bekanntesten Anbaugebiete Italiens. ",https://www.wein-direktimport.de/media/image/d5/81/a8/Sangiovese-Toscana-Rosso-2019-ZIP_200x300.jpg,https://www.wein-direktimport.de/weine/italien/toskana/tenuta-caparzo/2530/2019-sangiovese-rosso-toscana?c=362,1
209,Plumbago Rosso Sicilia DOC,Aziende Agricole Planeta S.S.,Italien,Sizilien,2018,red,11.0,13.5," Der 2018 La Segreta ‚Il Rosso‘ verzaubert mit Aromen von reifen Pflaumen, Brombeeren und Granatapfel, roten Johannisbeeren und Maulbeeren, ergänzt von feinen Gewürzaromen der Macchia.Am Gaumen ist ebenfalls frisch, mit sanften Gerbstoffen und harmonischer Säure.",https://www.wein-direktimport.de/media/image/b7/bd/6d/Plumbago_200x300.jpg,https://www.wein-direktimport.de/weine/italien/sizilien/planeta/3448/2018-plumbago-rosso-sicilia-doc?c=362,1
210,Côtes du Roussillon Villages 'Agly Brothers',Domaine de Bila Haut,Frankreich,Roussillon,2017,red,22.5,15.0," Joe Czerwinski, Wine Advocate, April 2019: „Still in tank, the 2017 Cotes du Roussillon Villages from this partnership of the Laughton and Chapoutier families features crushed stone and espresso aromas. This 60-40 blend of Grenache grown on schist and Syrah grown on gneiss is medium to full-bodied yet somehow light and agile at the same time and silky in texture, with a long finish redolent of dried spices and cocoa.“",https://www.wein-direktimport.de/media/image/5d/4d/4e/Agly-Brothers-Rouge-2017_200x300.jpg,https://www.wein-direktimport.de/weine/frankreich/roussillon/domaine-de-bila-haut/3453/2017-cotes-du-roussillon-villages-agly-brothers?c=362,1
211,Chianti Classico Riserva RANCIA,Fèlsina Società Agricola,Italien,Toscana,2017,red,37.5,13.5," Monica Larner, wine advocate, August 2020: „Rancia is always one of my favorite wines from this storied appellation (and the Castelnuovo Berardenga subzone). This vintage threw quite a few challenges at the winemaking team, but the Fèlsina 2017 Chianti Classico Riserva Rancia emerges intact, intense and beautiful. It is virtually unscathed by the heat and drought that marked this growing season. In fact, that brilliant radiance, linearity and energy of the Sangiovese grape comes through loud and clear. The bouquet is redolent of red fruit, wild berry, toasted almond, violet and potting soil. My score is a little lower (compared to past vintages) in terms of mouthfeel because I found this edition to be a bit shorter and less impactful on the finish, but not by much. It ages in barrique for up to 20 months. This vintage of Rancia saw 46,000 bottles released.“ Antonio Galloni, Vinous, September 2020: „The 2017 Chianti Classico Riserva Rancia is incredibly polished and sophisticated. Silky tannins give the 2017 its racy, sleek personality. Over the last year, the 2017 has really settled into a gorgeous place. There is plenty of vintage 2017 intensity, but Rancia is distinctly medium in body and restrained. The wilder side of Sangiovese, one of the signatures of Rancia and Fèlsina more broadly, tastes a bit baked out. I can't wait to see how the 2017 develops over the coming years and decades.“",https://www.wein-direktimport.de/media/image/60/94/91/Rancia-ZIP_200x300.jpg,https://www.wein-direktimport.de/weine/italien/toskana/felsina/3444/2017-chianti-classico-riserva-rancia?c=362,1
212,Fontalloro Toscana Rosso,Fèlsina Società Agricola,Italien,Toscana,2017,red,49.0,13.5," Monica Larner, wine advocate, August 2020: „The Fèlsina 2017 Fontalloro pours out of the bottle with a bang. This pure expression of Sangiovese is luscious and dark with thick layers of dark fruit, plum, cherry, leather and tilled earth. This hot-vintage edition shows good depth and intensity with lots of that black-fruit energy and extra concentration that is typical of this growing season. However, you can always count on Fontalloro to show balance, and that's exactly what you get here despite the adversity of the scorching summer season. That Sangiovese acidity remains intact and crisp. Production is 30,000 bottles.“ Antonio Galloni, Vinous, September 2020: „Fontalloro is exquisite in 2017. It is also such a contrast to the Rancia, as the two wines could not possibly be more different. Fontalloro is bright and vibrant, with more sweet red Sangiovese character than the darker Rancia. It is also incredibly delicious now, even though it clearly has the energy to age for many years. The 2017 is one of the finest Fontalloros I can remember tasting.“",https://www.wein-direktimport.de/media/image/7f/5b/bc/Fontalloro-ZIP_200x300.jpg,https://www.wein-direktimport.de/weine/italien/toskana/felsina/3442/2017-fontalloro-toscana-rosso?c=362,1
213,Chianti Classico Riserva Berardenga,Fèlsina Società Agricola,Italien,Toscana,2017,red,25.5,13.5," Monica Larner, wine advocate, August 2020: „The Fèlsina 2017 Chianti Classico Riserva Berardenga (with 70,000 bottles made) is a rich and sultry expression of pure Sangiovese with dark fruit intensity and a beautiful contouring of spice, leather and tar. This wine hits the intensity nail on the head without the overt over-ripeness that we saw in many of its peers from this hot and dry vintage. I would not recommend an especially long drinking window, but I can enthusiastically recommend this authentic taste of Chianti Classico for near or medium-term drinking. The Riserva ages in large Slavonian oak casks for 12 months.“ Antonio Galloni, Vinous, September 2020: „The 2017 Chianti Classico Riserva is a total knock-out. Sumptuous and enveloping, but with plenty of structure to support it all, the 2017 captures all the best elements of the house style. Succulent black cherry, worn-in leather, smoke, licorice and espresso all build in the glass as the 2017 shows off its curves. More than anything else, the 2017 is a wine of tremendous pleasure.“",https://www.wein-direktimport.de/media/image/ce/65/d2/Chianti-Classico-RISERVA-ZIP_200x300.jpg,https://www.wein-direktimport.de/weine/italien/toskana/felsina/3441/2017-chianti-classico-riserva-berardenga?c=362,1
214,Masseto,Masseto,Italien,Toscana,2017,red,770.0,15.5," Antonio Galloni, Vinous, März 2020: „The 2017 Masseto is a spectacular wine in the making. Rich and sumptuous in the glass, the 2017 possesses off the charts intensity and plenty of structure as well. Red cherry jam, mocha, leather, licorice and a dash of new oak are all fused together in an opulent, seamless Masseto endowed with magnificent balance. The 2017 is quite simply a remarkable wine for such a challenging year. I can't wait to taste it from bottle.“ Monica Larner, wine advocate, April 2019: „The Masseto 2017 Masseto puts on another exhilarating, knock-out performance for the third year in a row. The Masseto vineyard is a triangular-shaped plot tucked in at the back of the same property that houses the Ornellaia vineyards and winery. This special site is located at the base of the mountains that rise gently from the Tyrrhenian Sea, with the picturesque silhouette of the Castiglioncello castle at the top. The vines are planted at an altitude of 80 to 100 meters above sea level in blue clay soils that are unique to Bolgheri. That ideal position opens the vineyards to soft breezes, proximity to the sea, long daylight hours and cool diurnal shifts from the protective wall of low mountains at the back. It's a little garden of Merlot Eden. The center of the vineyard now is home to the new Masseto winery and an adjacent tasting room built into a pre-existing farmhouse. This wine was made in the old winery (the existing Ornellaia winery). Fermentation kicks off in a combination of steel and oak tanks before the wine is racked over to barrique, where it rests for two years. The wine then goes into bottle for 12 months before its release. Like most vintages of Masseto tasted this early in the game, the oak is omnipresent, and it grounds the wine in terms of texture and structure. It is powerful, but that's always the case with Masseto (this vintage records a 15.5% alcohol content). I tasted this wine next to the decidedly more playful Massetino, and the Masseto moves over the palate with substantial fruit weight and concentration gained over the course of this hot and dry growing season (which produced smaller, richer and more compact berries). Perhaps, what this vintage lacks is that profound varietal character that we saw in recent vintages like 2016 and 2015. If concerned that the hot vintage would draw out too many ripe fruit tones, the oak serves to soften some of the more volatile components of the fruit. Those distinctive notes of macchia mediterranea (wild bush) that I always associate with Masseto are less present in this vintage. You feel the oak tannins on the finish with toast and vanilla that will certainly shed as the wine ages. In fact, I went back to taste the wine 12 hours later, and they had already softened considerably. This 2017 vintage will be released in October 2020.“",https://www.wein-direktimport.de/media/image/96/cb/c9/Masseto-o-J_200x300.jpg,https://www.wein-direktimport.de/weine/italien/toskana/ornellaia/3423/2017-masseto?c=362,1
215,Toscana IGT 'Solaia' Magnum,Marchesi Antinori,Italien,Toscana,2017,red,750.0,14.0," Antonio Galloni, Vinous, August 2019 (!): „Just bottled, the 2017 Solaia is naturally going to need time to come together. Even in the early going, though, it shows all the richness and opulence that is typical of the year, with terrific aromatic expansiveness and tons of persistence. I can't wait to taste it with a bit more time in bottle.“ Monica Larner, wine advocate, August 2020: „The Marchesi Antinori 2017 Solaia offers a uniquely floral personality with wild rose and lilac that comes as a surprise, especially if you are expecting the more robust and opulent dark fruit associated with this vintage. To use a word that is popular now, the aromas are absolutely lifted. This is a bouquet-driven wine, showing great oak choices that are synergistic with the light and considerably thinner palate. Dried or pressed flowers cede to cherry, blueberry, some red meat char and a light touch of cinnamon. My impression is that the dry extract from the oak ultimately plays a bigger role in the overall flavor profile, preserving its red fruit core nevertheless. The wine is very accessible in terms of mouthfeel, showing a comparatively thinner and shorter approach. With more time in the glass, it offers some of the white soil dust that is a standard Solaia signature. It will be released the first week of September.“",https://www.wein-direktimport.de/media/image/18/66/b3/Solaia_200x300.jpg,https://www.wein-direktimport.de/alle-weine/typ/magnum-doppelmagnum.../3424/2017-toscana-igt-solaia-magnum?c=362,1
216,Toscana IGT 'Solaia',Marchesi Antinori,Italien,Toscana,2017,red,299.0,14.0," Antonio Galloni, Vinous, August 2019 (!): „Just bottled, the 2017 Solaia is naturally going to need time to come together. Even in the early going, though, it shows all the richness and opulence that is typical of the year, with terrific aromatic expansiveness and tons of persistence. I can't wait to taste it with a bit more time in bottle.“ Monica Larner, wine advocate, August 2020: „The Marchesi Antinori 2017 Solaia offers a uniquely floral personality with wild rose and lilac that comes as a surprise, especially if you are expecting the more robust and opulent dark fruit associated with this vintage. To use a word that is popular now, the aromas are absolutely lifted. This is a bouquet-driven wine, showing great oak choices that are synergistic with the light and considerably thinner palate. Dried or pressed flowers cede to cherry, blueberry, some red meat char and a light touch of cinnamon. My impression is that the dry extract from the oak ultimately plays a bigger role in the overall flavor profile, preserving its red fruit core nevertheless. The wine is very accessible in terms of mouthfeel, showing a comparatively thinner and shorter approach. With more time in the glass, it offers some of the white soil dust that is a standard Solaia signature. It will be released the first week of September.“",https://www.wein-direktimport.de/media/image/18/66/b3/Solaia_200x300.jpg,https://www.wein-direktimport.de/weine/italien/toskana/marchese-antinori/3395/2017-toscana-igt-solaia?c=362,1
217,Rioja Lindes de Remelluri 'San Vincente',Granja de Remelluri,Spanien,Rioja,2016,red,16.25,14.0," Der 2016 Lindes 'San Vincente' duftet intensiv nach saftiger Kirschfrucht, reifen roten Beeren, dunklen Waldbeeren, dazu kommen milde Gewürze, unterlegt von Vanille und rauchiger Holzwürze und feiner balsamischer Würze. Am Gaumen ist der Wein sehr charmant, hat eine saftige Frucht, wieder viel Kirsche, feiner süßer Kern, leicht pfeffrig. Dazu die würzige Holzaromatik, begleitet von etwas rustikaleren, jugendlichen Gerbstoffen.Etwas Luftkontakt im Dekanter schadet nicht. Versuchen Sie den 2016 San Vincente zu feinem Lamm, Rind oder frischem Brot mit Weichkäse. Dieser Wein ist wirklich begeisternd. Selten hat uns ein Rioja dieser Preisklasse derart viel Spaß bereitet. Luis Gutiérrez, wine advocate, Juli 2020: „It's interesting to compare the 2016 Lindes de Remelluri Viñedos de San Vicente de la Sonsierra with the wine from the same year but from the external suppliers from Labastida, as the two wines are produced in the same way, after a natural fermentation in small vats and oak casks and matured in a combination of barriques of different origins and aged for 13 months. The grapes from San Vicente usually achieve more ripeness, which is the case in this 2016. It's a little less precise and focused than the Labastida, especially on the nose. There is a little more rusticity on the palate, with some dusty tannins. Again, I think it represents the character of the village. 43,200 bottles produced. It was bottled in April and May 2018.“",https://www.wein-direktimport.de/media/image/27/2e/aa/2016-Lindes-St-VincenteZIP_200x300.jpg,https://www.wein-direktimport.de/weine/spanien/rioja/granja-de-remelluri/3364/2016-rioja-lindes-de-remelluri-san-vincente?c=362,1
218,Santenay Rouge 'Clos des Hâtes',Domaine Hubert Lamy,Frankreich,Bourgogne,2019,red,39.9,13.0," William Kelley, Wine Advocate, Januar 2021: „The 2019 Santenay Clos des Hâtes is very promising, mingling notes of cassis and raspberries with hints of peony and spicy oak. Medium-bodied, lively and concentrated, it's deep and tightly wound, with superb depth at the core, tangy acids and refined tannins.“",https://www.wein-direktimport.de/media/image/0b/fb/ef/Santenay-Rouge-Clos-Hates-ZIP_200x300.jpg,https://www.wein-direktimport.de/weine/frankreich/bourgogne/cote-d-or/hubert-lamy/4423/2019-santenay-rouge-clos-des-hates?c=362,1
219,Santenay Rouge 'Clos des Hâtes',Domaine Hubert Lamy,Frankreich,Bourgogne,2018,red,39.0,13.0," William Kelley, wine advocate, Februar 2020: „The 2018 Santenay Clos des Hâtes soars from the glass with scents of ripe berry fruit, spices, dark chocolate and potpourri. Medium to full-bodied, perfumed and textural, this is a deep, rich Santenay that's muscular but elegant, confirming Lamy's prowess with Pinot Noir.“",https://www.wein-direktimport.de/media/image/65/8c/36/Santenay-Rouge-Clos-Hates_200x300.jpg,https://www.wein-direktimport.de/weine/frankreich/bourgogne/cote-d-or/hubert-lamy/3306/2018-santenay-rouge-clos-des-hates?c=362,1
220,Barolo,Cantina Bartolo Mascarello,Italien,Piemont,2016,red,,14.5," Antonio Galloni, Vinous, Februar 2020: „Maria Teresa Mascarello made one of the wines of the vintage in 2016. Her 2016 Barolo is soft and sensual, but also quite hushed - as many wines are in this vintage in the early going. Medium in body with silky tannins and exceptional balance, the 2016 has so much to offer, but it is also going to require quite a bit of time to be at its very best. Just after bottling, the 2016 was more generous and rich, but it is decidedly closed today. I wouldn't dream of touching a bottle before age ten, and even that will be early for a super-classic Barolo. Rose petal, mint, crushed flowers, anise and blood orange develop with time in the glass, but the 2016 is a Barolo for readers who can afford to be patient.“ Monica Larner, wine advocate, Juli 2020: „This is the stuff of dreams. Tasted so young, I did a lot of coaxing to nudge the wine along, thanks to a double decant and a few extra hours in an open bottle. I tasted both samples I had over the course of a few weeks. Those efforts served well, but the wine remains packed tight and full of nervous energy regardless, indicating that its true potential won't be seen for another 10 or 20 years, or likely more. The Bartolo Mascarello 2016 Barolo is a true icon of the vintage. The approach is elongated and silky, like lifting honey from a jar. The aromas are chiseled and focused with wild berry, licorice, candied orange peel, campfire ash, rusted iron, crushed graphite and pencil shaving. The wine's personality is downplayed, elegant and demure in one tasting but exuberant and expressive in the next. The tannins show snap and crunch, indicating they will drive the wine forward over many years of cellar age. This is one of those rare wines that is poised to improve with each increment of time. Structurally, it is perfect. If we were to create a template for an aspirational Barolo, this would be it.“",https://www.wein-direktimport.de/media/image/e5/ca/8b/Mascarello-BaroloMBGcSWVlD7JqK_200x300.jpg,https://www.wein-direktimport.de/weine/italien/piemont/bartolo-mascarello/3267/2016-barolo?c=362,1
221,GSM,Bodegas Castaño,Spanien,Yecla,2018,red,7.9,14.0," Der 2018 GSM hat eine intensive dunkelrote Farbe. In der Nase üppige Aromen von reifen roten Früchten und süßem Gebäck. Am Gaumen ist der 2018 GSM saftig und sehr fruchtig. Zu den genannten Aromen kommen noch die von roten Pflaumen, Brombeeren, ein Hauch Holz und Lakritze dazu. Die Struktur ist samtig und weich, die sanften Gerbstoffe sind perfekt eingebunden. Die Verabschiedung erfolgt elegant und überraschend lang anhaltend.",https://www.wein-direktimport.de/media/image/35/63/ef/GSM-o-J_200x300.jpg,https://www.wein-direktimport.de/weine/spanien/yecla/bodegas-castano/3245/2018-gsm?c=362,1
222,Zweigelt Beerenauslese 375 ml,Weingut Kracher,Österreich,Burgenland,2018,red,16.5,10.5," Das helle Kirschrot funkelt im Glas. In der Nase Aromen unter anderem von reifen Süßkirschen, reifen Erdbeeren und getrockneten Pflaumen.Am Gaumen süßer Auftakt mit frischer, harmonischer Säure, komplexe Frucht, deutlicher Rotweincharakter mit Aromen von roten Johannisbeeren, Kirschkompott und Erdbeerkonfitüre. Die feinen Gerbstoffe sind ein zusätzlicher Hinweis auf die verwendete, rote Rebsorte, passen sich aber perfekt ein. Etwas Rumtopf- und frische Zitrusaromen runden den perfekten Eindruck ab. Ideal zu Schokoladendesserts.",https://www.wein-direktimport.de/media/image/af/e8/29/Zweigelt-Beerenauslese_200x300.jpg,https://www.wein-direktimport.de/weine/oesterreich/burgenland/weingut-kracher/3227/2018-zweigelt-beerenauslese-375-ml?c=362,1
223,Lagrein 'Rubatsch',Manincor,Italien,Südtirol/Alto Adige,2018,red,29.5,13.0," Der 2018 Lagrein Rubatsch ist schwarz wie die Nacht, allerdings mit purpurfarbenen Reflexen. In der Nase satte Aromen von reifen Pflaumen, reifen Süßkirschen, Brombeeren, Süßholz, Holunder, und etwas Karamel. Am Gaumen samtig weicher Auftakt, gefolgt von präsenten, aber reifen Gerbstoffen, bereits jetzt ist der Wein ausgesprochen harmonisch und präsent, sollte aber auf jeden Fall dekantiert und in großen Bordeauxgläsern serviert werden.",https://www.wein-direktimport.de/media/image/5a/86/0f/2018-Rubatsch-Lagrein_200x300.jpg,https://www.wein-direktimport.de/weine/italien/suedtirol/manincor/3224/2018-lagrein-rubatsch?c=362,1
224,"Syrah ""Case Via""",Az. Agr. Fontodi,Italien,Toscana,2016,red,39.0,15.0," Monica Larner, wine advocate, September 2019: „I love the richness, coupled by the finesse of the 2016 Syrah Case Via. This beautiful expression hits that elusive intersection of elegance and power with bullseye precision. This is an impressive effort that brings forth beautifully balanced aromas of dark fruit, blackberry, spice, leather and earthy terracotta. I'd love to come back and try this Tuscan Syrah ten years from now.“",https://www.wein-direktimport.de/media/image/0d/d2/ae/Casa-Via-2016_200x300.jpg,https://www.wein-direktimport.de/weine/italien/toskana/fontodi/857/2016-syrah-case-via?c=362,1
225,Pago La Jara,Gago Viticultores de Toro,Spanien,Toro,2016,red,39.5,14.0,,https://www.wein-direktimport.de/media/image/67/20/6d/Pago-la-Jara-o-J_200x300.jpg,https://www.wein-direktimport.de/weine/spanien/toro/gago-viticultores-de-toro/3177/2017-pago-la-jara?c=362,1
226,Rouge 'Oudan',Domaine Sérol,Frankreich,Loire,2018,red,16.5,12.0," Der Wein hat ein wunderschönes, leuchtendes Granatrot. In der Nase hat er herrliche Aromen von frischen Süß- und Sauerkirschen, reifen roten Früchten und feine Gewürze. Am Gaumen ist er dicht und samtig-saftig, mit feiner Mineralik und großartiger, eleganter Struktur.",https://www.wein-direktimport.de/media/image/34/8a/54/Oudan-2018_200x300.jpg,https://www.wein-direktimport.de/weine/frankreich/loire/domaine-robert-serol/3174/2018-rouge-oudan?c=362,1
227,Rouge 'Perdrizière',Domaine Sérol,Frankreich,Loire,2018,red,17.95,12.5," Der 2018 Perdrizière hat wunderschöne Aromen von roten Früchten wie frischen Himbeeren, eine feine leicht rauchige Mineralik sowie ausgeprägte Aromen von Gewürzen. Am Gaumen startet er sanft und weich, mit saftiger, tiefer Frucht, klarer Mineralik und wunderbarem Aromenspiel.",https://www.wein-direktimport.de/media/image/f9/72/65/Perdrizi-re-2018_200x300.jpg,https://www.wein-direktimport.de/weine/frankreich/loire/domaine-robert-serol/3173/2018-rouge-perdriziere?c=362,1
228,Rouge 'Chez Coste',Domaine Sérol,Frankreich,Loire,2018,red,28.5,13.5,,https://www.wein-direktimport.de/media/image/02/62/6b/Chez-Coste-2018_200x300.jpg,https://www.wein-direktimport.de/weine/frankreich/loire/domaine-robert-serol/3175/2018-rouge-chez-coste?c=362,1
229,"Brunello di Montalcino ""La Casa""",Caparzo,Italien,Toscana,2015,red,49.5,13.5," Ian D’Agata, Vinous, April 2020: „Good full ruby. Brooding aromas of cassis, menthol, chocolate and minerals. Dense and juicy but slightly hard at present, with a floral nuance and nicely integrated acidity lending precision to the red fruit and violet flavors. The slightly tough tannins and the dumbed down fruit leave an impression of medicinal austerity on the long mouthcoating finish. Needs time.“ Monica Larner, wine advocate, Januar 2020: „Caparzo's 2015 Brunello di Montalcino Vigna La Casa opens to a very fine and precise bouquet that is carefully assembled with crisp berry notes, smoke, tar, licorice and toasted almond. The wine remains very tight and crisp overall, but it does cede to more volume and puts on more weight as it opens in the glass. There is a pretty note of crushed stone or granite on the close. The La Casa vineyard site is characterized by clay soils broken up with shards of Galestro schist that adds to the cool and fresh profile of the wine. This lovely single-vineyard Brunello is almost ready to drink (wait a few more years), but it should also withstand the next 10 years of cellar aging should you decide to put your bottle aside. Some 15,000 bottles were produced. The wine was bottled in August 2019 and released in January 2020.“",https://www.wein-direktimport.de/media/image/86/c2/dc/La-Casa-Brunello-2015-ZIP_200x300.jpg,https://www.wein-direktimport.de/weine/italien/toskana/tenuta-caparzo/3149/2015-brunello-di-montalcino-la-casa?c=362,1
