,wine_name,wine_winery,wine_country,wine_region,wine_year,wine_type,wine_price,wine_alcohol,wine_description,wine_thumb,wine_url,wine_seller
411,WIN WIN Riesling Gutswein trocken,Weingut von Winning,Deutschland,Pfalz,2018,white,11.0,12.0," Am Gaumen ist der 2019 Win Win Riesling frisch, saftig, derzeit noch ein wenig jugendlich, zart phenolisch, wunderbar klar, leicht „steinig“ und mit kühler, vom großen Holzfaß geprägter Stilistik. Die frische Säure wirkt äußerst anregend, auch am Gaumen kommt die wunderbare „steinige“ Mineralik wieder voll zur Geltung, eine Prise Süße nimmt die trockene Spitze. Tolle Länge!",https://www.wein-direktimport.de/media/image/57/fa/6c/WinWin_200x300.jpg,https://www.wein-direktimport.de/weine/deutschland/pfalz/weingut-von-winning/4248/2020-win-win-riesling-gutswein-trocken?c=559,1
412,Westhofener Riesling trocken,Weingut Wittmann,Deutschland,Rheinhessen,2020,white,24.0,12.5," Der 2020 Westhofener Riesling Erste Lage trocken verzaubert mit einer intensiven Aromatik, derzeit dominieren reife Grapefruit Zitronengras und Limette. Etwas im Hintergrund kommen noch reifer gelber Apfel, Orangenzeste, Quitte, Aprikose und Papaya dazu, mit Luftkontakt werden diese Aromen noch intensiver.Am Gaumen startet der Wein kraftvoll mit ausgeprägter, fast schon salziger Mineralik. Viel reife saftige Säure und die sehr dezente Restsüße fokussieren den Wein auf Struktur und Frucht. Er ist kühl und elegant, zupackend und sanft zugleich, anregend, fast fordernd und im nächsten Moment wieder von einer wunderbar anregenden Harmonie. Das ist ein wirklich großartiger „Premier Cru“ aus Rheinhessen, der sich vor den GG nicht verstecken muß.      ",https://www.wein-direktimport.de/media/image/33/81/a6/2020-Westhofener-Riesling-Erste-Lage-ZIPDrHSBXzPRXR34_200x300.jpg,https://www.wein-direktimport.de/weine/deutschland/rheinhessen/weingut-philipp-wittmann/4244/2020-westhofener-riesling-trocken?c=559,1
413,Niersteiner Riesling trocken,Weingut Wittmann,Deutschland,Rheinhessen,2020,white,24.0,12.5," Der 2020 Niersteiner Riesling Erste Lage trocken hat in der Nase Aromen unter anderem von Zitronengras, roten und weißen Johannisbeeren, Limette, ein wenig reife Aprikose. Dazu feine Kräuterwürze und Grapefruit.Am Gaumen saftiger Auftakt, klare Mineralik, fast salzig ergänzt von knackiger Säure, die perfekt eingebunden ist. Füllige Frucht, saftig, dabei sehr elegant und fein, weniger wuchtig als die Westhofener Weine, aber dennoch äußerst faszinierend. Langer Nachhall.",https://www.wein-direktimport.de/media/image/fb/1e/54/2020-Niesteiner-Riesling-Erste-Lage-ZIP_200x300.jpg,https://www.wein-direktimport.de/weine/deutschland/rheinhessen/weingut-philipp-wittmann/4245/2020-niersteiner-riesling-trocken?c=559,1
414,Gundersheimer Riesling trocken,Weingut Wittmann,Deutschland,Rheinhessen,2020,white,20.0,12.0," Der 2020 Gundersheimer Riesling Erste Lage ist sehr fein, er duftet unter anderem nach Orangenzesten, frischem Pfirsich, reifen Zitronen, dezent nach gerösteten Nüssen und fein nach frischen Kräutern.Am Gaumen wieder sehr fein, der Auftakt ist überraschend rund und samtig, aber dennoch frisch und klar. Die frische Säure paßt perfekt, ist nicht aufdringlich, sondern anregend, das paßt ganz wunderbar zur feinen Stilistik dieses auffallend „leisen“ Weines. Der perfekte Wein für Fans eleganter Rieslinge",https://www.wein-direktimport.de/media/image/bd/ba/d7/2020-Gundersheimer-Riesling-Erste-Lage-ZIP_200x300.jpg,https://www.wein-direktimport.de/weine/deutschland/rheinhessen/weingut-philipp-wittmann/4246/2020-gundersheimer-riesling-trocken?c=559,1
415,"Sauvignon Blanc II, Von Winning Weinmanufaktur",Weingut von Winning,Deutschland,Pfalz,2020,white,11.0,12.0," Die Nase ist zart aber erstaunlich komplex, unter anderem gibt es Aromen von Grapefruit, ein Hauch Stachelbeere, dazu Minze, grüne Paprika und Mango. Am Gaumen ist er frisch, die lebhafte Säure sorgt für feinsten Trinkzug, der Wein ist im positiven Sinne süffig und klar. Er hat einen feinen Schmelz und verabschiedet sich so angenehm trocken wie er gekommen ist.",https://www.wein-direktimport.de/media/image/23/23/0e/Sauvignon-II-ZIP_200x300.jpg,https://www.wein-direktimport.de/weine/deutschland/pfalz/weingut-von-winning/4250/2020-sauvignon-blanc-ii-von-winning-weinmanufaktur?c=559,1
416,Sauvignon Blanc I,Weingut von Winning,Deutschland,Pfalz,2019,white,19.5,12.5," Stephan Reinhardt, Wine Advocate, Januar 2020: „Very intense in its lemon color, von Winning's 2019 Sauvignon Blanc I opens with an intense and concentrated bouquet of ripe fruits (domestic and tropical fruit aromas ranging from white and green to yellow) intertwined with the spicy flavor of fine oak. If the Sauvignon II is Sancerre, the Sauvignon I is Pessac-Léognan and built more on concentration and power. On the palate, this is a full-bodied, intense and juicy Sauvignon Blanc with good freshness, fine tannins and ripe peach and mango aromas on the finish. It already drinks easily but is an ambitious, well-structured Sauvignon Blanc. Tasted as a sample in May 2020.“",https://www.wein-direktimport.de/media/image/59/1e/0f/Sauvignon-I-ZIPM7AVoBbsokiVv_200x300.jpg,https://www.wein-direktimport.de/weine/deutschland/pfalz/weingut-von-winning/4249/2019-sauvignon-blanc-i?c=559,1
417,Riesling Großes Gewächs Norheimer Dellchen,Weingut Dönnhoff,Deutschland,Nahe,2020,white,50.0,13.0," Stephan Reinhardt, Wine Advocate, September 2021: „From slate and porphyry soils, the Norheim 2020 Dellchen Riesling GG is clear, pure, fresh and flinty on the nose that reveals a ripe and concentrated seed-fruit aroma. Full-bodied, intense and salty on the palate, this is a pure, rich, elegant and powerful but refined Dellchen  with a long, intense and sustainable finish. A great wine that just needs some years to shine in full brightness. 13% alcohol. Tasted at the domain in July 2021.“",https://www.wein-direktimport.de/media/image/14/6e/97/2020-GG-Dellchen-ZIP_200x300.jpg,https://www.wein-direktimport.de/weine/deutschland/nahe/weingut-doennhoff/4235/2020-riesling-grosses-gewaechs-norheimer-dellchen?c=559,1
418,Riesling GG Schloßböckelheimer Felsenberg FELSENTÜRMCHEN,Weingut Dönnhoff,Deutschland,Nahe,2020,white,44.0,13.0," Stephan Reinhardt, Wine Advocate, September 2021: „The 2020 Felsenberg GG is deep, intense and complex on the pure and elegant, well-defined and slightly flinty nose. Pure, intense and juicy on the palate, this is a crystalline, refined and salty Felsenberg with great terroir expression and length, even though the wine is still puristic or even ascetic in the finish. Not as charmingly fruity as Crusius’s interpretation but with the same length and tension. 13% alcohol. Tasted at the domain in July 2021 and again six weeks later in Wiesbaden during the GG tastings.“",https://www.wein-direktimport.de/media/image/99/f2/b4/Felsenberg-GG-ZIP_200x300.jpg,https://www.wein-direktimport.de/weine/deutschland/nahe/weingut-doennhoff/4233/2020-riesling-gg-schlossboeckelheimer-felsenberg-felsentuermchen?c=559,1
419,Riesling Großes Gewächs Kreuznacher Krötenpfuhl,Weingut Dönnhoff,Deutschland,Nahe,2020,white,33.0,13.0," Stephan Reinhardt, Wine Advocate, September 2021: „The Kreuznach 2020 Krötenpfuhl GG is from gravel-quartzite soils and opens with clear, fresh, ripe and elegant fruit on the nose. Round and juicy on the palate, this is a full-bodied, lush Riesling with fine phenolic grip on the salty-piquant finish. The 2020 is a long and substantial Riesling with ripe fruit expression and terroir-driven vitality. 13% alcohol. Tasted at the domain in July and again at Wiesbaden’s GG tastings in August 2021.“",https://www.wein-direktimport.de/media/image/75/e5/fe/Kroetenpfuhl-GG-ZIP_200x300.jpg,https://www.wein-direktimport.de/weine/deutschland/nahe/weingut-doennhoff/4236/2020-riesling-grosses-gewaechs-kreuznacher-kroetenpfuhl?c=559,1
420,Riesling Großes Gewächs Felsenberg,Weingut Schäfer-Fröhlich,Deutschland,Nahe,2020,white,48.0,13.0,,https://www.wein-direktimport.de/media/image/fb/e2/d2/2020-GG-Felsenberg-ZIP_200x300.jpg,https://www.wein-direktimport.de/weine/deutschland/nahe/weingut-schaefer-froehlich/4225/2020-riesling-grosses-gewaechs-felsenberg?c=559,1
421,Riesling Großes Gewächs Stromberg,Weingut Schäfer-Fröhlich,Deutschland,Nahe,2020,white,53.0,13.0,,https://www.wein-direktimport.de/media/image/cd/d0/ea/2020-GG-Stromberg-ZIP_200x300.jpg,https://www.wein-direktimport.de/weine/deutschland/nahe/weingut-schaefer-froehlich/4226/2020-riesling-grosses-gewaechs-stromberg?c=559,1
422,Riesling trocken Gutswein 'Drache',Weingut von Winning,Deutschland,Pfalz,2020,white,8.9,12.0," In der Nase hat der hellgelbe 2020 Riesling Drache anregende und intensive Aromen von gelbem Apfel, reifem Pfirsich, Zitrone und Zitronengras. Dazu kommen eine dezente, ätherische Minzenote, Aromen weißer Blüten und milde Korianderwürze.Am Gaumen ist er wunderbar saftig und frisch, er hat eine belebende Säure, eine elegant-würzige Frucht und einen feinen Gripp mit dezenter Süße und klarer Mineralik.",https://www.wein-direktimport.de/media/image/58/ca/49/2020-Drache-ZIP_200x300.jpg,https://www.wein-direktimport.de/weine/deutschland/pfalz/weingut-von-winning/4228/2020-riesling-trocken-gutswein-drache?c=559,1
423,Chardonnay trocken 'Vom Kalkstein',Weingut K.-H. Milch,Deutschland,Rheinhessen,2020,white,8.2,13.0,,https://www.wein-direktimport.de/media/image/3c/24/1c/CH-Kalkstein_200x300.jpg,https://www.wein-direktimport.de/weine/deutschland/rheinhessen/weingut-milch/2529/2020-chardonnay-trocken-vom-kalkstein?c=559,1
424,Grüner Veltliner trocken Engabrunner STEIN,Weingut Bernhard Ott,Österreich,Wagram,2019,white,29.95,13.0," Falstaff, Peter Moser, Weinguide Österreich 2021/22: „Helles Gelbgrün, Silberreflexe. Zart floral unterlegte weiße Kernobstnuancen, zart nussiger Touch, etwas Mango, Orangenzesten und Blütenhonig klingen an. Saftig, komplex, frischer Säurebogen, lebendig und zitronig, wirkt schlank und leichtfüßig, ein finessenreicher Speisenbegleiter.“",https://www.wein-direktimport.de/media/image/83/b6/5b/2019-Stein-ZIP_200x300.jpg,https://www.wein-direktimport.de/weine/oesterreich/wagram/weingut-ott/4214/2019-gruener-veltliner-trocken-engabrunner-stein?c=559,1
425,Grüner Veltliner trocken Feuersbrunner SPIEGEL,Weingut Bernhard Ott,Österreich,Wagram,2019,white,29.95,13.0," Falstaff, Peter Moser, Weinguide Österreich 2021/22: „Helles Gelbgrün, Silberreflexe. Mit einem Hauch von Anis und Kümmel unterlegte feine gelbe Tropenfrucht, zart nach Mandarinenzesten, Nuancen von Blütenhonig. Komplex, saftig, feiner Hauch von Marille, elegant und sehr lange anhaftend, zarte Süße im Abgang, sehr gutes Entwicklungspotenzial.“",https://www.wein-direktimport.de/media/image/8c/d1/e6/2019-Spiegel-ZIP_200x300.jpg,https://www.wein-direktimport.de/weine/oesterreich/wagram/weingut-ott/4215/2019-gruener-veltliner-trocken-feuersbrunner-spiegel?c=559,1
426,Grüner Veltliner trocken Feuersbrunner ROSENBERG,Weingut Bernhard Ott,Österreich,Wagram,2019,white,33.9,13.5," Falstaff, Peter Moser, Weinguide Österreich 2021/22: „Mittleres Gelbgrün, Silberreflexe. Frische Orangenzesten, ein Hauch von reifem Apfel, zart nach Ananas, feine florale Nuancen, sehr einladendes Bukett. Saftig, elegant, feine Fruchtsüße, gut integrierter Säurebogen, ausgewogen und lange anhaftend, ein stoffiger Speisenbegleiter mit Würze und Potenzial.“",https://www.wein-direktimport.de/media/image/d8/f6/fc/2019-Rosenberg-ZIP_200x300.jpg,https://www.wein-direktimport.de/weine/oesterreich/wagram/weingut-ott/4216/2019-gruener-veltliner-trocken-feuersbrunner-rosenberg?c=559,1
427,Grüner Veltliner trocken DER OTT®,Weingut Bernhard Ott,Österreich,Niederösterreich,2020,white,25.9,12.5," Der 2020 Grüner Veltliner DER OTT leuchtet mit brilliantem Gelbgrün. In der Nase hat er feine Aromen von frischer Maracuja, den ätherischen Touch von Melisse, eine feine Kräuterwürze und etwas reifem Pfirsich.Am Gaumen ist er saftig und elegant, die zarte Extraktsüße paßt perfekt zur frischen Säurestruktur. Im Abgang gesellt sich noch eine klare Apfelfrucht dazu. Komplexer Nachhall, 'Der OTT' ist ein großartiger Speisenbegleiter.",https://www.wein-direktimport.de/media/image/0a/95/58/2020-Der-OTT-ZIP_200x300.jpg,https://www.wein-direktimport.de/weine/oesterreich/wagram/weingut-ott/3812/2020-gruener-veltliner-trocken-der-ott?c=559,1
428,Grauburgunder trocken,Weingut Winter,Deutschland,Rheinhessen,2020,white,9.2,12.5,,https://www.wein-direktimport.de/media/image/0f/2b/ae/Grauburgunder-ZIPeoTGfKnGpFj49_200x300.jpg,https://www.wein-direktimport.de/weine/deutschland/rheinhessen/weingut-stefan-winter/4204/2020-grauburgunder-trocken?c=559,1
429,Riesling Selection „Ried Pfaffenberg“ Magnum,Weingut Emmerich Knoll,Österreich,Wachau,2015,white,82.0,13.0," Peter Moser, Falstaff Weinguide Österreich 2015/16: „Helles Grüngelb, Silberreflexe. Zart nach gelber Fruchtexotik, Nuancen von Ananas und Maracuja, dunkle Mineralik unterlegt. Knackig und straff, betont mineralisch, weiße Fruchtnuancen, bleibt gut haften, Limettentouch im Rückgeschmack.“",https://www.wein-direktimport.de/media/image/f2/06/ae/2014-Riesling-PFAFFENBERG-SELECTION-MG-ZIP_200x300.jpg,https://www.wein-direktimport.de/weine/oesterreich/wachau/weingut-emmerich-knoll/4196/2014-riesling-selection-ried-pfaffenberg-magnum?c=559,1
430,Riesling Smaragd „Ried Kellerberg“ Magnum,Weingut Emmerich Knoll,Österreich,Wachau,2016,white,89.0,13.0," Peter Moser, Falstaff Weinguide Österreich 2017/18: „Helles Gelbgrün, Silberreflexe. Ein Hauch von Mandarinenzesten, gelber Weingartenpfirsich, ein Hauch von Limettenzesten, mineralischer Touch. Elegant, straff, feine weiße Fruchtnuancen, rassige Säurestruktur, angenehme Fruchtsüße im Nachhall, sehr gutes Zukunftspotential.“",https://www.wein-direktimport.de/media/image/50/c9/e0/2016-RIESLING-Kellerberg-Smaragd-Magnum-ZIP_200x300.jpg,https://www.wein-direktimport.de/weine/oesterreich/wachau/weingut-emmerich-knoll/4195/2016-riesling-smaragd-ried-kellerberg-magnum?c=559,1
431,Riesling Smaragd „Ried Schütt“ Magnum,Weingut Emmerich Knoll,Österreich,Wachau,2014,white,115.0,12.5," Peter Moser, Falstaff Weinguide Österreich 2015/16: „Helles Grüngelb, Silberreflexe. Einladende gelbe Pfirsichfrucht, Nuancen von reifen Ringlotten, zarter Blütenhonig, mineralisch unterlegt. Saftig, feine weiße Frucht, zarter Steinobsttouch, frisch strukturiert, filigran und mineralisch, ein fein ziselierter Rieslingstil mit Zukunftspotential.“",https://www.wein-direktimport.de/media/image/04/78/4c/2014-Riesling-SCH-TT-MG-ZIP_200x300.jpg,https://www.wein-direktimport.de/weine/oesterreich/wachau/weingut-emmerich-knoll/4197/2014-riesling-smaragd-ried-schuett-magnum?c=559,1
432,Grüner Veltliner Smaragd „Ried Schütt“ Magnum,Weingut Emmerich Knoll,Österreich,Wachau,2016,white,96.0,13.0," Peter Moser, Falstaff, Juni 2017: "" Helles Gelbgrün, Silberreflexe. Ein Hauch von Orangenzesten, feine weiße Apfelfrucht, ein Hauch von Mango, zarter Blütenhonig. Elegant, feine, ausgewogene Textur, weiße Tropenfrucht, gut integrierte Säurestruktur, wirkt sehr leichtfüßig, ein Hauch von Marille im Nachhall.""",https://www.wein-direktimport.de/media/image/0e/80/84/GV-Smaragd-Schuett-MAGNUM-ZIPCpHmvGlD8U0mp_200x300.jpg,https://www.wein-direktimport.de/weine/oesterreich/wachau/weingut-emmerich-knoll/4192/2016-gruener-veltliner-smaragd-ried-schuett-magnum?c=559,1
433,"Grüner Veltliner ""Loibner"" Federspiel",Weingut Emmerich Knoll,Österreich,Wachau,2020,white,16.9,12.0," Peter Moser, Falstaff Weinguide Österreich 2021/22: „Helles Gelbgrün, Silberreflexe. Feine Wiesenkräuter, etwas nach gelbem Kernobst, ein Hauch von Mandarinenzesten, Maracuja klingt an. Saftig, leichtfüßig, balancierte Säurestruktur, zarte Birnenfrucht im Abgang, bereits gut antrinkbar.“",https://www.wein-direktimport.de/media/image/ee/c3/5b/GV-Loibner-Federspiel-ZIPG2qmzDxdYyRel_200x300.jpg,https://www.wein-direktimport.de/weine/oesterreich/wachau/weingut-emmerich-knoll/4186/2020-gruener-veltliner-loibner-federspiel?c=559,1
434,Riesling Smaragd „Ried Schütt“ Doppelmagnum,Weingut Emmerich Knoll,Österreich,Wachau,2018,white,265.0,13.5," Peter Moser, Falstaff Weinguide Österreich 2019/20: „Helles Gelbgrün, Silberreflexe. Feine Ananasfrucht, ein Hauch von Blütenhonig, zart nach kandierten Orangenzesten, mineralisch und ausdrucksvoll. Kraftvoll, stoffig, extraktsüß, feine gelbe Tropenfrucht, bleib haften, Limetten im Nachhall, salziger Rückgeschmack, großes Potenzial.“",https://www.wein-direktimport.de/media/image/71/8e/92/Riesling-Ried-Sch-tt-DMG-ZIP_200x300.jpg,https://www.wein-direktimport.de/weine/oesterreich/wachau/weingut-emmerich-knoll/4191/2018-riesling-smaragd-ried-schuett-doppelmagnum?c=559,1
435,"Grüner Veltliner ""Ried Kreutles"" Federspiel",Weingut Emmerich Knoll,Österreich,Wachau,2020,white,19.9,12.0," Peter Moser, Falstaff, Federspiel Cup 2021: „Helles Gelbgrün, silberfarbene Reflexe. Zarte Wiesenkräuter, ein Hauch von frischen Marillen und gelbem Apfel, zart nach Blütenhonig. Saftig, elegant und ausgewogen, ein Hauch von Mango, integrierter Säurebogen, bleibt gut haften, ein vielseitiger Speisenbegleiter.“",https://www.wein-direktimport.de/media/image/aa/ea/6f/2020-GV-Kreutles-Federspiel-ZIP_200x300.jpg,https://www.wein-direktimport.de/weine/oesterreich/wachau/weingut-emmerich-knoll/4187/2020-gruener-veltliner-ried-kreutles-federspiel?c=559,1
436,Riesling Selection „Ried Pfaffenberg“ Doppelmagnum,Weingut Emmerich Knoll,Österreich,Wachau,2018,white,240.0,13.5," Peter Moser, Falstaff Weinguide Österreich 2020/21: „Mittleres Gelbgrün, Silberreflexe. Frische Würze, gelber Pfirsich, Blütenhonig und Orangenzesten unterlegen, reife Ananas, unverwechselbarer Pfaffenbergertouch. Saftig, komplex, feine Fruchtsüße, eingebundene Säurestruktur, elegant und anhaftend, gute Länge, sicheres Reifepotenzial.“",https://www.wein-direktimport.de/media/image/22/47/06/Riesling-Pfaffenberg-DMG-ZIP_200x300.jpg,https://www.wein-direktimport.de/weine/oesterreich/wachau/weingut-emmerich-knoll/4190/2018-riesling-selection-ried-pfaffenberg-doppelmagnum?c=559,1
437,Riesling,Weingut Knebel,Deutschland,Mosel,2020,white,11.5,12.0,,/themes/Frontend/WeinDirektimport/frontend/_public/src/img/no-picture.jpg,https://www.wein-direktimport.de/weine/deutschland/mosel-und-saar/weingut-knebel/4179/2020-riesling?c=559,1
438,Weissburgunder trocken,Weingut Knebel,Deutschland,Mosel,2020,white,12.5,12.0,,https://www.wein-direktimport.de/media/image/34/5b/87/2016-gutswein-weissburgundersNgqP91Ad9lAG_200x300.jpg,https://www.wein-direktimport.de/weine/deutschland/mosel-und-saar/weingut-knebel/4180/2020-weissburgunder-trocken?c=559,1
439,Riesling Kabinett 'Röttgen',Weingut Knebel,Deutschland,Mosel,2020,white,19.5,9.0," Mit dem 2020 Riesling Kabinett hat Matthias Knebel einen Wein im Sortiment, der die Mosel berühmt gemacht hat. Mit 9% Alkohol ist er so leicht wie ein Kabinett alter Schule, geblieben ist aber die exotische, saftige Frucht und die elegante, feine, fast schon verspielte Art eines Weißweins, den es so nur hier geben kann. Am Gaumen überrascht die feine Süße nicht, sie paßt hervorragend zur intensiven Aromatik und der sanften, feinen Eleganz. Sie ist nicht aufdringlich und perfekt auf die frische, feine Säure abgestimmt.",https://www.wein-direktimport.de/media/image/5d/a7/92/2020-R-ttgen-Kabinett-ZIP_200x300.jpg,https://www.wein-direktimport.de/weine/deutschland/mosel-und-saar/weingut-knebel/4181/2020-riesling-kabinett-roettgen?c=559,1
440,Riesling trocken 'Von den Terrassen',Weingut Knebel,Deutschland,Mosel,2020,white,15.9,12.0," Der 2020 Riesling trocken ‚Von den Terrassen‘ hat in der Nase deutliche Aromen von frischem Pfirsich, Aprikose, Zitrone, Zitronenzeste, etwas Koriandersamen und die typische, leicht rauchige Schieferwürze und Mineralik.Am Gaumen beginnt er frisch, saftig, mit lebhafter Säure und intensiver Mineralik. Der Wein ist sehr klar und geht direkt ins Zentrum für haptisch-olfaktorische Geschmackseindrücke. Nach längerer Luftzufuhr (dekantieren!) entwickelt sich zusätzlich das Aroma von reifer Ananas und dezent Karamel. Die feine Phenolik sorgt für zusätzliche Würze.  Dekantieren nicht vergessen.",https://www.wein-direktimport.de/media/image/c3/2f/75/2020-Von-den-Terrassen-ZIP_200x300.jpg,https://www.wein-direktimport.de/weine/deutschland/mosel-und-saar/weingut-knebel/4182/2020-riesling-trocken-von-den-terrassen?c=559,1
441,Riesling trocken JACOBUS,Weingut Peter Jakob Kühn,Deutschland,Rheingau,2019,white,12.9,12.0,,https://www.wein-direktimport.de/media/image/4c/a7/4c/Jacobus-ZIP_200x300.jpg,https://www.wein-direktimport.de/weine/deutschland/rheingau/weingut-peter-jakob-kuehn/4177/2019-riesling-trocken-jacobus?c=559,1
442,Riesling Hallgarten 'Rheinschiefer',Weingut Peter Jakob Kühn,Deutschland,Rheingau,2019,white,15.5,12.0,,https://www.wein-direktimport.de/media/image/4b/7b/24/Rheinschiefer-ZIP_200x300.jpg,https://www.wein-direktimport.de/weine/deutschland/rheingau/weingut-peter-jakob-kuehn/4176/2019-riesling-hallgarten-rheinschiefer?c=559,1
443,Riesling trocken Hallgartener Hendelberg,Weingut Peter Jakob Kühn,Deutschland,Rheingau,2019,white,27.0,12.5,,https://www.wein-direktimport.de/media/image/44/7a/09/Hendelberg-ZIP_200x300.jpg,https://www.wein-direktimport.de/weine/deutschland/rheingau/weingut-peter-jakob-kuehn/4174/2019-riesling-trocken-hallgartener-hendelberg?c=559,1
444,Riesling feinherb Haus Klosterberg,Weingut Markus Molitor,Deutschland,Mosel,2020,white,9.9,10.5,,https://www.wein-direktimport.de/media/image/a8/6a/7b/Riesling-Klosterberg-feinherb-ZIP-jpg_200x300.jpg,https://www.wein-direktimport.de/weine/deutschland/mosel-und-saar/weingut-markus-molitor/4167/2020-riesling-feinherb-haus-klosterberg?c=559,1
445,Riesling Haus Klosterberg weiße Kapsel  ml,Weingut Markus Molitor,Deutschland,Mosel,2020,white,9.9,12.5,,/themes/Frontend/WeinDirektimport/frontend/_public/src/img/no-picture.jpg,https://www.wein-direktimport.de/weine/deutschland/mosel-und-saar/weingut-markus-molitor/4165/2020-riesling-haus-klosterberg-weisse-kapsel-1000-ml?c=559,1
446,Franken Silvaner trocken Liter,Weingut Horst Sauer,Deutschland,Franken,2020,white,7.95,12.0," In der Nase ist der 2020 Franken Silvaner wunderbar frisch und harmonisch, er hat feine Aromen unter anderem von frische geschälter Birne, grünem Apfel, etwas Quitte, Zitrone und Orangenschale. Am Gaumen ist er saftig, hat eine belebende Säure und eine frische, feine Frucht. Trotz seiner Zartheit und dem niedrigem Alkoholgehalt behauptet sich der Silvaner überraschend gut gegenüber leichten und mittelkräfigen Speisen. Er paßt ideal zu Spargel und pochiertem Fisch!",https://www.wein-direktimport.de/media/image/c3/44/8c/Franken-Silvaner-Liter-ZIP_200x300.jpg,https://www.wein-direktimport.de/weine/deutschland/franken/weingut-horst-sauer/4161/2020-franken-silvaner-trocken-liter?c=559,1
447,Escherndorf Silvaner trocken,Weingut Horst Sauer,Deutschland,Franken,2020,white,9.5,12.0," In der Nase hat der 2020 Escherndorf Silvaner trocken ein wunderbares Aromenspiel. Aromen von reifen grünen Sommeräpfeln, Quittenapfel, etwas Honigmelone, Zitronenzeste und gelbe Birne.Am Gaumen klarer, eleganter Auftakt, die Frucht ist cremig, aber insgesamt verhalten, hier gibt es mehr Mineralik, eine feine Phenolik und Zitrusfrucht, die anregende Säure harmoniert perfekt mit dem präzisen Charakter des Weines. Gute mittlere Länge, wunderbar für jeden Tag geeignet.",https://www.wein-direktimport.de/media/image/30/6d/63/2020-Silvaner-Escherndorfer-II-ZIP_200x300.jpg,https://www.wein-direktimport.de/weine/deutschland/franken/weingut-horst-sauer/4160/2020-escherndorf-silvaner-trocken?c=559,1
448,Silvaner S. trocken Escherndorfer Lump,Weingut Horst Sauer,Deutschland,Franken,2020,white,13.5,13.0," Der 2020 Silvaner S. Escherndorfer Lump hat eine klare und sehr aromatische Nase.  Aromen von reifer Williamsbirne, gelbem Apfel, Honigmelone, ergänzt von frischer Zitrusfrucht, etwas weißem Pfeffer und feinen floralen Aromen.Am Gaumen frischer Auftakt, auch hier sehr klar, elegant und sehr präzise, dazu paßt die saftige, cremige Frucht perfekt. Die Mineralik ist präsent und in Verbindung mit der anregenden Säure sorgt sie für einen perfekten Spannungsbogen bis in den langen Abgang hinein. Das ist (fast) eine Große Gewächs Qualität zum fairen Preis.",https://www.wein-direktimport.de/media/image/23/5a/e6/2020-Silvaner-S-Escherndorfer-Lump-ZIP_200x300.jpg,https://www.wein-direktimport.de/weine/deutschland/franken/weingut-horst-sauer/4159/2020-silvaner-s.-trocken-escherndorfer-lump?c=559,1
449,Chablis Vieilles Vignes,Bessin - Tremblay (Domaine Bessin),Frankreich,Bourgogne,2019,white,23.5,14.0," Was für ein Wein! Mit dem 2019 Chablis Vieille Vignes legt Bessin die Latte sehr hoch, hier handelt es sich sicherlich um die beste Vieille Vignes Qualität der AOC.Präsente, klare Nase in Kombination mit klarer, kühler Mineralik. Dann Pampelmuse, grüner Apfel, Honig, weiße Blüten, etwas Rauch, die Frucht öffnet sich vergleichsweise schnell.Am Gaumen wunderbar saftig und würzig, tolle, elegante Struktur, unglaublich anregend, feine, reife Säure, süßer Kern, wieder klare Mineralik. Öffnet sich auch am Gaumen, wird dicht und leicht rauchig, dazu die feine Phenolik, gute Länge, großartiges Finish.",https://www.wein-direktimport.de/media/image/37/0c/8a/2019-Chablis-V-V-ZIP_200x300.jpg,https://www.wein-direktimport.de/weine/frankreich/bourgogne/chablis/bessin-tremblay-domaine-bessin/3991/2019-chablis-vieilles-vignes?c=559,1
