,best_match_score,__id_left,__id_right,full_name_left,wine_country_left,wine_type_left,full_name_right,wine_country_right,wine_type_right
1805,1.3538806079888106,12_left,2454_right,PAUL MAS VIGNES DE NICOLE Rouge,Frankreich,red,Paul Mas Vignes de Nicole Rouge,Frankreich,red
23359,1.1734160530329945,264_left,6509_right,WINZER KREMS Grüner Veltliner,Österreich,white,Winzer Krems Chremisa Edition Grüner Veltliner,Österreich,white
7568,1.0965149964081327,66_left,5370_right,LA LUNA E I FALÒ Barbera d'Asti,Italien,red,Vite Colte La Luna e i Falò Barbera d'Asti Superiore,Italien,red
15363,0.9892885363928176,161_left,8192_right,PAUL MAS Vignes de Nicole Blanc,Frankreich,white,Paul Mas Vignes de Nicole l'Assemblage Blanc,Frankreich,white
19041,0.9859724057987533,201_left,9038_right,"MONTE ZOVO Lugana ""Le Civaie""",Italien,white,Monte Zovo Lugana Le Civaie,Italien,white
23176,0.94135526322605,262_left,452_right,RAWSON'S RETREAT Chardonnay,Australien,white,Rawson's Retreat Sémillon - Chardonnay,Australien,white
12135,0.9207190959342776,121_left,4365_right,MONTES Alpha Cabernet Sauvignon,Chile,red,Montes Alpha Cabernet Sauvignon,Chile,red
13716,0.8958978855169061,141_left,7320_right,ZANTHO Zweigelt,Österreich,red,Zantho Zweigelt,Österreich,red
13610,0.8764637713079847,139_left,4196_right,BRAZIN Lodi Old Vine Zinfandel,USA,red,Brazin (B) Old Vine Zinfandel Lodi,Vereinigte Staaten,red
17606,0.7942862705430402,187_left,800_right,FEUDO ARANCIO Grillo,Italien,white,Feudo Arancio Grillo Sicilia,Italien,white
8728,0.767405051471926,79_left,1503_right,CARPINETO Chianti Classico Riserva,Italien,red,Carpineto Chianti Classico Riserva,Italien,red
6179,0.7650859316651158,54_left,3807_right,SAN NICOLAO Barbera d'Asti,Italien,red,Vite Colte San Nicolao Barbera d'Asti,Italien,red
12134,0.7488362067016789,120_left,3830_right,MONTES Alpha Syrah,Chile,red,Montes Alpha Syrah,Chile,red
11838,0.7268502594110551,117_left,4450_right,MONTES Cabernet Sauvignon Reserva,Chile,red,Montes Reserva Cabernet Sauvignon (Classic),Chile,red
20465,0.6988508178415029,216_left,1051_right,KARL PFAFFMANN Weißburgunder,Deutschland,white,Karl Pfaffmann Markus Pfaffmann Weissburgunder Trocken,Deutschland,white
13554,0.6521052889078831,135_left,6824_right,KAIKEN Ultra Cabernet Sauvignon,Argentinien,red,Kaiken Cabernet Sauvignon,Argentinien,red
13606,0.6516599297979967,137_left,3996_right,BEYERSKLOOF Synergy,Südafrika,red,Beyerskloof Synergy Cape Blend,Südafrika,red
20856,0.6509081331484198,225_left,2253_right,KLOSTER EBERBACH Riesling,Deutschland,white,Kloster Eberbach Riesling Trocken,Deutschland,white
18762,0.6423773679616183,198_left,5204_right,KURTATSCH Pinot Grigio,Italien,white,Cantina Kurtatsch Pinot Grigio,Italien,white
4282,0.6298833571490063,31_left,5448_right,CHÂTEAU LA TOUR DE BY Magnum,Frankreich,red,Château La Tour de By Château la Roque de By,Frankreich,red
8727,0.6193120795968667,78_left,5201_right,LE MORTELLE Botrosecco,Italien,red,Le Mortelle Botrosecco Maremma Toscana,Italien,red
16075,0.5652627728348345,167_left,7801_right,CHÂTEAU PAUL MAS Belluguette,Frankreich,white,Paul Mas Château Paul Mas Parcelle Belluguette Languedoc Blanc,Frankreich,white
9021,0.5651951264390124,83_left,4876_right,PAOLO MANZONE Barolo,Italien,red,Paolo Manzone Barolo Meriame,Italien,red
5311,0.562286051625525,41_left,5448_right,CHÂTEAU LA TOUR DE BY Heritage,Frankreich,red,Château La Tour de By Château la Roque de By,Frankreich,red
20800,0.5554395945456662,222_left,6056_right,WINTER Grauburgunder,Deutschland,white,Stefan Winter Grauburgunder,Deutschland,white
15129,0.554905125502938,158_left,10546_right,LE BLANC DE MONSIEUR HENRI,Frankreich,white,Monsieur Henri Le Rosé de Monsieur Henri Merlot,Frankreich,rosé
7995,0.5389031088450744,70_left,12330_right,VECCHIA TORRE Leverano Riserva,Italien,red,Vecchia Torre Leverano Rosato,Italien,rosé
20979,0.5279631713763616,227_left,3085_right,VILLA HUESGEN Riesling Kabinett,Deutschland,white,Villa Huesgen By the Glass Riesling,Deutschland,white
11537,0.5238120002960264,111_left,490_right,BERONIA Gran Reserva,Spanien,red,Beronia Rioja Gran Reserva,Spanien,red
16868,0.4994687457600801,179_left,424_right,JADOT Pouilly-Fuissé Petites Pierres,Frankreich,white,Louis Jadot Pouilly-Fuissé,Frankreich,white
19734,0.49714410070862036,208_left,2266_right,MONTES Sauvignon Blanc,Chile,white,Montes Reserva Sauvignon Blanc (Classic),Chile,white
20034,0.4823249395887104,211_left,5715_right,RUPPERTSBERGER Riesling,Deutschland,white,Fußer Ruppertsberger Riesling,Deutschland,white
22116,0.4634000842873448,242_left,6892_right,MARKUS MOLITOR Zeltinger Ortswein,Deutschland,white,Markus Molitor Zeltinger Sonnenuhr Riesling Kabinett,Deutschland,white
18667,0.4563771283422169,196_left,11977_right,LOREDAN GASPARINI Prosecco Frizzante,Italien,white,Loredan Gasparini Asolo Prosecco Superiore,Italien,sparkling
5086,0.45164909080312543,39_left,7836_right,CHÂTEAU LA COMMANDERIE,Frankreich,red,Château La Commanderie Saint-Estèphe,Frankreich,red
14890,0.44114119499413224,155_left,8860_right,LES FUMÉES BLANCHES Blanc,Frankreich,white,François Lurton Les Fumées Blanches Sauvignon Blanc Côtes de Gascogne,Frankreich,white
16870,0.4250384343530918,180_left,1159_right,JADOT Chassagne-Montrachet Baudines,Frankreich,white,Paul Pillot Chassagne-Montrachet,Frankreich,white
21820,0.4074001670365542,238_left,1461_right,WINTER Alte Reben Riesling,Deutschland,white,Schneider Alte Reben Riesling,Deutschland,white
20461,0.40064293713127436,215_left,7422_right,WINTER Riesling,Deutschland,white,Stefan Winter Riesling Trocken,Deutschland,white
20466,0.3818727950837806,217_left,2277_right,TABERNUS Grauer Burgunder,Deutschland,white,Korrell Grauer Burgunder,Deutschland,white
13435,0.38100307169191633,134_left,11007_right,BLEASDALE Bremerview Shiraz,Australien,red,Bleasdale Sparkling Shiraz,Australien,sparkling
12139,0.3791663819068013,122_left,3830_right,MONTES Alpha M,Chile,red,Montes Alpha Syrah,Chile,red
6160,0.37833868334513887,53_left,5013_right,SALICE SALENTINO,Italien,red,Epicuro Salice Salentino,Italien,red
14489,0.37822401697860647,150_left,5037_right,CÔTÉ MAS Sauvignon Blanc,Frankreich,white,Paul Mas Sauvignon Blanc,Frankreich,white
20847,0.3718384618949812,224_left,2277_right,SONNENHOF Grauer Burgunder,Deutschland,white,Korrell Grauer Burgunder,Deutschland,white
11126,0.35922149193231095,106_left,1631_right,BERONIA Reserva,Spanien,red,Beronia Rioja Reserva,Spanien,red
9348,0.3568658498079553,86_left,5797_right,LA PODERINA Brunello di Montalcino,Italien,red,La Gerla Brunello di Montalcino,Italien,red
18927,0.3551711501703868,200_left,10888_right,BOSCO DEL MERLO Sauvignon Blanc,Italien,white,Bosco del Merlo Brut Rosé,Italien,sparkling
23411,0.3488989972017484,266_left,1087_right,GÖTTWEIG Grüner Veltliner,Österreich,white,Meinklang Grüner Veltliner,Österreich,white
23361,0.3488989972017484,265_left,1087_right,ZIMMERMANN Grüner Veltliner,Österreich,white,Meinklang Grüner Veltliner,Österreich,white
23740,0.3456014391790096,270_left,7752_right,GÖTTWEIG Grüner Veltliner Reserve,Österreich,white,Steininger Kamptal Reserve Grüner Veltliner,Österreich,white
6180,0.3384801864559845,55_left,1813_right,RIPORTA Nero d'Avola,Italien,red,Cusumano Nero d'Avola,Italien,red
14296,0.3367138223200416,148_left,5377_right,CAZAL VIEL Sauvignon Blanc,Frankreich,white,Le Val Sauvignon Blanc,Frankreich,white
22367,0.33116585942083365,247_left,2315_right,BECKER Grauburgunder Tradition,Deutschland,white,Friedrich Becker Grauburgunder,Deutschland,white
18663,0.3307447781450411,195_left,9442_right,PRÀ Soave,Italien,white,Prà Otto Soave,Italien,white
22358,0.31802680889249024,246_left,6147_right,KÜNSTLER Riesling 1648,Deutschland,white,Künstler Riesling Trocken,Deutschland,white
9186,0.3179285569886447,85_left,9089_right,SAROTTO Barbaresco Riserva,Italien,red,Ceretto Barbaresco,Italien,red
5531,0.30881656688183906,44_left,625_right,JADOT Aloxe-Corton,Frankreich,red,Joseph Drouhin Aloxe-Corton,Frankreich,red
22356,0.2962078245640985,245_left,6372_right,GEIL Riesling Rosengarten,Deutschland,white,Weingut Geil Riesling Trocken,Deutschland,white
8388,0.29559460503459956,73_left,2117_right,TORCICODA Primitivo,Italien,red,Tormaresca Primitivo Salento Torcicoda,Italien,red
12420,0.29245932963219184,126_left,7634_right,BECKER Pinot Noir Tradition,Deutschland,red,Friedrich Becker Schweigen Pinot Noir,Deutschland,red
2578,0.2901977471653107,17_left,3719_right,CHÂTEAU CAZAL VIEL Vieilles Vignes,Frankreich,red,Château Fontarèche Vieilles Vignes Sélection,Frankreich,red
11839,0.28715389316583123,118_left,10104_right,MONTES Angel's Selection,Chile,red,Montes Sparkling Angel Brut,Chile,sparkling
3636,0.2844221123132478,25_left,5731_right,DOMAINE DE VILLEMAJOU Rouge,Frankreich,red,Domaine de l'Horizon Rouge,Frankreich,red
5728,0.282084857162136,48_left,5901_right,LA CARRAIA Sangiovese,Italien,red,La Mozza Sangiovese,Italien,red
20864,0.27896003104628486,226_left,6772_right,GRANS-FASSIAN Fuder 12 Riesling,Deutschland,white,Grans-Fassian Mineralschiefer Riesling - Trocken,Deutschland,white
16292,0.2761438529515736,169_left,798_right,CHÂTEAU DE ROCHEMORIN Blanc,Frankreich,white,Château de Sancerre Sancerre Blanc,Frankreich,white
4122,0.2710006375305431,29_left,3679_right,CHÂTEAU L'HOSPITALET,Frankreich,red,Château l'Hospitalet La Clape Grand Vin Rouge,Frankreich,red
22961,0.2697135898818939,256_left,6196_right,TABERNUS Riesling-Gewürztraminer,Deutschland,white,Knipser Gewürztraminer - Riesling Trocken,Deutschland,white
16318,0.26872214438982384,170_left,9532_right,MONTAGNY 1er CRU Montcuchot,Frankreich,white,Louis Latour Montagny 1er Cru La Grande Roche,Frankreich,white
7806,0.2650598007839827,68_left,1931_right,WALCH - von Keller Lagrein,Italien,red,Wilhelm Walch Lagrein,Italien,red
17194,0.26414820015403745,183_left,11357_right,CHÂTEAU BÉTHANIE,Frankreich,white,Château Béthanie Crémant du Jura Brut,Frankreich,sparkling
710,0.25528018684604636,6_left,2893_right,CHÂTEAU DE JAU Rouge,Frankreich,red,Château de Jau Côtes du Roussillon Villages,Frankreich,red
11788,0.25517923747371124,115_left,9187_right,EDWARDS Cabernet Sauvignon Reserva,Chile,red,de Gras Reserva Cabernet Sauvignon,Chile,red
21787,0.24218197964273122,236_left,8117_right,DR. CRUSIUS Porphyr Weißburgunder,Deutschland,white,Dr. Loosen Weißburgunder,Deutschland,white
5959,0.23811853199962513,51_left,1813_right,LUIGI AVOGADRI Nero d'Avola,Italien,red,Cusumano Nero d'Avola,Italien,red
11365,0.22782355162095447,108_left,776_right,CELESTE Crianza,Spanien,red,Pago del Cielo Celeste Crianza,Spanien,red
8333,0.2252504572466538,72_left,470_right,LE BOCCE Chianti Classico Riserva,Italien,red,Brancaia Chianti Classico Riserva,Italien,red
4123,0.22079342038746416,30_left,4344_right,CHÂTEAU PAUL MAS Clos de Savignac,Frankreich,red,Paul Mas Château Paul Mas Coteaux du Languedoc Clos des Mures,Frankreich,red
20242,0.21066800957039442,213_left,1051_right,KARL PFAFFMANN Riesling,Deutschland,white,Karl Pfaffmann Markus Pfaffmann Weissburgunder Trocken,Deutschland,white
21791,0.20767922445885156,237_left,6235_right,REINHARDT Weißburgunder,Deutschland,white,Schneider Weissburgunder,Deutschland,white
13556,0.20617243528780316,136_left,7702_right,SURVIVOR Pinotage,Südafrika,red,Simonsig Pinotage,Südafrika,red
12398,0.20524485938088538,124_left,1599_right,SONNENHOF Pinot Noir,Deutschland,red,Heitlinger Pinot Noir,Deutschland,red
11814,0.20292705309411618,116_left,1945_right,EDWARDS Carmenère Reserva,Chile,red,Caliterra Reserva Carmenère,Chile,red
9854,0.19831281439832607,91_left,2830_right,AVOGADRI Primitivo-Negroamaro,Italien,red,Mezzatia Primitivo - Negroamaro,Italien,red
10729,0.1937653588104404,101_left,1155_right,VIÑA DIEZMO Crianza,Spanien,red,Viña Olabarri Crianza,Spanien,red
4716,0.18970612164757078,36_left,3679_right,CHÂTEAU DE LA SOUJEOLE Grand Vin,Frankreich,red,Château l'Hospitalet La Clape Grand Vin Rouge,Frankreich,red
5697,0.18770540688845222,46_left,4247_right,Sangiovese,Italien,red,Caparzo Sangiovese Toscana,Italien,red
14673,0.18215918236687628,152_left,1473_right,CHÂTEAU LE RAZ Le Dauphin,Frankreich,white,Château le Reysse Médoc,Frankreich,red
11538,0.181541578481895,112_left,1315_right,VALSERRANO Gran Reserva,Spanien,red,Protos Gran Reserva,Spanien,red
19476,0.17675957713738372,206_left,4497_right,MONTESPINA Verdejo,Spanien,white,Protos Verdejo,Spanien,white
20005,0.17605462713695777,210_left,6235_right,RUPPERTSBERGER Weißburgunder,Deutschland,white,Schneider Weissburgunder,Deutschland,white
6889,0.17365712616486947,61_left,133_right,DOGAJOLO,Italien,red,Carpineto Toscana Dogajolo Rosso,Italien,red
8776,0.17318209969072657,81_left,6319_right,FARNITO Cabernet Sauvignon,Italien,red,Alturis Cabernet Sauvignon,Italien,red
22962,0.1660202939481584,257_left,6235_right,GEIL Weißburgunder,Deutschland,white,Schneider Weissburgunder,Deutschland,white
14828,0.15931112138772052,153_left,2972_right,DOMAINE BOSQUET Chardonnay,Frankreich,white,Domaine Montrose Chardonnay,Frankreich,white
22932,0.15598596075935903,255_left,6235_right,MATHILDE Weißburgunder,Deutschland,white,Schneider Weissburgunder,Deutschland,white
16808,0.1500514278163409,177_left,1739_right,CHABLIS 1er CRU Beauroy,Frankreich,white,La Chablisienne Chablis 1er Cru 'Fourchaume',Frankreich,white
10939,0.14630228981294316,104_left,4119_right,VIÑA DIEZMO Reserva,Spanien,red,Viña Pedrosa Reserva,Spanien,red
9578,0.14573511125673472,88_left,4402_right,PRÀ Amarone,Italien,red,Prà Morandina Amarone della Valpolicella,Italien,red
23879,0.14256719462936823,272_left,2118_right,PFAFFL Hund,Österreich,white,Weingut R&A Pfaffl Hund Grüner Veltliner Reserve,Österreich,white
23016,0.1399214124447725,259_left,2886_right,WINTER Bodenständig,Deutschland,white,Stefan Winter Weissburgunder,Deutschland,white
15364,0.1385800720648885,162_left,8417_right,MONTAGNY Vieilles Vignes,Frankreich,white,Les Mougeottes Vieilles Vignes Chardonnay,Frankreich,white
14835,0.13652744574488967,154_left,2071_right,SAINT-PEYRE Picpoul de Pinet,Frankreich,white,Paul Mas Picpoul De Pinet Réserve,Frankreich,white
22327,0.13626722743282768,244_left,3949_right,SCHARZHOFBERGER Riesling Spätlese,Deutschland,white,Schloss Vollrads Riesling Spätlese,Deutschland,white
9799,0.13620786303615745,90_left,1813_right,TERRE DEL SOLE Nero d'Avola,Italien,red,Cusumano Nero d'Avola,Italien,red
18222,0.13609921050834287,193_left,1335_right,LE ROSE DI ORNELLA Pinot Grigio,Italien,white,La Tunella Pinot Grigio,Italien,white
10436,0.1356703220883199,98_left,11316_right,TORRE ORIA Crianza,Spanien,red,Torre Oria Cava Chardonnay Brut,Spanien,sparkling
4713,0.13211159789254748,35_left,3110_right,CHÂTEAU LA CROIX ROMANE,Frankreich,red,Château La Croix du Duc Bordeaux,Frankreich,red
10574,0.12568369022879247,99_left,1315_right,GRAN MARIUS Reserva,Spanien,red,Protos Gran Reserva,Spanien,red
19068,0.12247368612388211,203_left,10988_right,TERRE DEL SOLE Grillo,Italien,white,Contri Terre del Sole Fragolino,Italien,sparkling
22011,0.1179072970666685,240_left,4086_right,KÜNSTLER Riesling Edition,Deutschland,white,Schloss Vollrads Edition Riesling,Deutschland,white
22720,0.11712903881806837,250_left,6147_right,KÜNSTLER Pfandloch,Deutschland,white,Künstler Riesling Trocken,Deutschland,white
10736,0.11590385288883716,102_left,675_right,LAR DE PAULA Oak Aged,Spanien,red,Pago de Cirsus Oak Aged Red Blend,Spanien,red
8615,0.11550955461458713,76_left,1596_right,NINO NEGRI Sassella,Italien,red,Nino Negri Sfursat Carlo Negri,Italien,red
2581,0.11529489898892333,18_left,5731_right,DOMAINE DE L'ARJOLLE Cabernet,Frankreich,red,Domaine de l'Horizon Rouge,Frankreich,red
23025,0.10766234026126854,260_left,1461_right,HAACK Scheurebe Alte Reben,Deutschland,white,Schneider Alte Reben Riesling,Deutschland,white
13979,0.10712496509648263,144_left,5377_right,LE TAPIE Blanc,Frankreich,white,Le Val Sauvignon Blanc,Frankreich,white
23595,0.10527211310061106,268_left,2065_right,ERZHERZOG JOHANN Sauvignon Blanc,Österreich,white,Sattlerhof Sauvignon Blanc,Österreich,white
20611,0.10251811117129553,219_left,1085_right,IHRINGER Grauburgunder,Deutschland,white,Schneider Grauburgunder,Deutschland,white
20755,0.10251811117129553,221_left,1085_right,SCHÖNLAUB Grauburgunder,Deutschland,white,Schneider Grauburgunder,Deutschland,white
20981,0.10251811117129553,228_left,1085_right,MESSMER Grauburgunder,Deutschland,white,Schneider Grauburgunder,Deutschland,white
7513,0.09044689900352486,65_left,77_right,LE BOCCE Chianti Classico,Italien,red,Banfi Chianti Classico,Italien,red
4484,0.08685828365434234,33_left,798_right,CHÂTEAU DE BARBE BLANCHE,Frankreich,red,Château de Sancerre Sancerre Blanc,Frankreich,white
8597,0.08639343920812938,75_left,193_right,PRUNOTTO Bansella,Italien,red,Prunotto Barolo,Italien,red
14034,0.08525666228469148,146_left,4744_right,DOMAINE PUGIBET Le Blanc,Frankreich,white,Domaine de l'Horizon Blanc,Frankreich,white
13607,0.083824312603047,138_left,2635_right,SURVIVOR Pinotage Reserve,Südafrika,red,Wildekrans Barrel Select Reserve Pinotage,Südafrika,red
16341,0.08318920506631791,173_left,798_right,CHÂTEAU DE NAVAILLES,Frankreich,white,Château de Sancerre Sancerre Blanc,Frankreich,white
526,0.08218256680984556,4_left,447_right,PAUL MAS Cabernet de Cabernet,Frankreich,red,Paul Mas Vignes de Nicole Cabernet Sauvignon - Merlot Pays d'Oc,Frankreich,red
15318,0.07765199698484235,160_left,798_right,CHÂTEAU BONNET Blanc,Frankreich,white,Château de Sancerre Sancerre Blanc,Frankreich,white
9977,0.0776115740695458,93_left,4695_right,ANDERGASSEN Lagrein,Italien,red,Tramin Lagrein,Italien,red
14491,0.07626092542694289,151_left,7561_right,LA CABANE DU GASCON Blanc,Frankreich,white,Domaine de Pellehaut L'Été Gascon Blanc,Frankreich,white
17327,0.0751386068309847,184_left,798_right,CHÂTEAU DE VILLEMAJOU Grand V. Blanc,Frankreich,white,Château de Sancerre Sancerre Blanc,Frankreich,white
13161,0.07044908108276084,131_left,11567_right,PIRRAMIMMA Petit Verdot,Australien,red,Rustenberg Petit Verdot Rosé,Südafrika,rosé
21173,0.07016902235883753,230_left,1051_right,KARL PFAFFMANN Riesling Hölle,Deutschland,white,Karl Pfaffmann Markus Pfaffmann Weissburgunder Trocken,Deutschland,white
6230,0.07011217580815342,56_left,12330_right,VECCHIA TORRE Primitivo,Italien,red,Vecchia Torre Leverano Rosato,Italien,rosé
5725,0.06757992933820134,47_left,2759_right,CASTEL FIRMIAN Teroldego,Italien,red,Mezzacorona Castel Firmian Lagrein Riserva,Italien,red
18126,0.0647359588510014,192_left,234_right,CONTI DI COLLOREDO Pinot Grigio,Italien,white,Zenato Pinot Grigio,Italien,white
16336,0.06298432421715168,172_left,1288_right,POUILLY-FUMÉ Les Genièvres,Frankreich,white,Domaine A Cailbourdin Les Cris Pouilly-Fumé,Frankreich,white
5588,0.06233582730442734,45_left,4472_right,JADOT Volnay,Frankreich,red,Louis Jadot Chablis,Frankreich,white
16589,0.061766528835168026,175_left,7087_right,SANCERRE Les Vignolles,Frankreich,white,Dauny Sancerre 'Les Caillottes',Frankreich,white
16319,0.05824392463337642,171_left,3810_right,JEAN GEILER Gewürztraminer,Frankreich,white,Cleebourg Gewürztraminer,Frankreich,white
22991,0.057878100059527496,258_left,2409_right,TABERNUS Chardonnay,Deutschland,white,Schneider Chardonnay,Deutschland,white
17759,0.057674601145244614,190_left,12330_right,VECCHIA TORRE Vermentino,Italien,white,Vecchia Torre Leverano Rosato,Italien,rosé
4005,0.056632356832561244,28_left,22_right,CASTELMAURE Grande Cuvée,Frankreich,red,Keringer Grande Cuvée,Österreich,red
2022,0.05605077501737323,14_left,3796_right,LE CHAMP DES MURAILLES,Frankreich,red,Domaine la Croix Belle Le Champ des Lys,Frankreich,white
10298,0.05493648088667637,96_left,7244_right,PRINCIPIO Garnacha,Spanien,red,Intruso Garnacha,Spanien,red
19042,0.05282431341296361,202_left,225_right,VILLA DUGO Sauvignon Blanc,Italien,white,Attems Sauvignon Blanc,Italien,white
17758,0.05242581043378756,189_left,5277_right,LE VELE Verdicchio,Italien,white,Moncaro Verdicchio Dei Castelli Di Jesi Classico Le Vele,Italien,white
20802,0.050824847471803,223_left,1085_right,MATHILDE Grauburgunder,Deutschland,white,Schneider Grauburgunder,Deutschland,white
3047,0.050414455232265024,21_left,4765_right,Rhônetal RASTEAU Rouge,Frankreich,red,Domaine Montrose Rouge,Frankreich,red
17353,0.047824653559926954,185_left,290_right,CHABLIS 1er CRU Les Lys,Frankreich,white,La Chablisienne Chablis Grand Cru 'Les Preuses',Frankreich,white
15306,0.044638483059319764,159_left,8132_right,JEAN GEILER Pinot Blanc,Frankreich,white,Mader Pinot Blanc,Frankreich,white
22570,0.040005923891127636,249_left,6147_right,KÜNSTLER Terroir Blanc,Deutschland,white,Künstler Riesling Trocken,Deutschland,white
12409,0.0392894782377216,125_left,1599_right,KLOSTER EBERBACH Pinot Noir,Deutschland,red,Heitlinger Pinot Noir,Deutschland,red
18760,0.0357930126217793,197_left,8294_right,GARETTO Moscato d’Asti,Italien,white,Rivetti Massimo Maggiorina Moscato d'Asti,Italien,white
5932,0.03538382383046593,50_left,5904_right,ANTICOSASSO Merlot,Italien,red,Tramin Merlot,Italien,red
14891,0.0339072751122351,156_left,1271_right,DOMAINE DE LA QUILLA Muscadet,Frankreich,white,Domaine de la Renaudie Sauvignon,Frankreich,white
5481,0.028926734497614317,43_left,3576_right,Les 49 Lignes,Frankreich,red,Delas Les Launes Crozes-Hermitage,Frankreich,red
4662,0.02845056501201787,34_left,5448_right,CHÂTEAU DE ROCHEMORIN Rouge,Frankreich,red,Château La Tour de By Château la Roque de By,Frankreich,red
21395,0.028047764005086552,232_left,852_right,DR. CRUSIUS Rhyolith Riesling,Deutschland,white,Dr. Loosen Riesling Trocken,Deutschland,white
22927,0.027925076601319022,254_left,3611_right,TABERNUS Blanc de Noirs,Deutschland,white,Fußer Blanc de Pinot Noir,Deutschland,white
16818,0.026958767313823576,178_left,1564_right,CIGALUS Blanc BIO**,Frankreich,white,Gérard Bertrand Domaine De Cigalus Blanc,Frankreich,white
11368,0.02663655551770679,109_left,669_right,VALSERRANO Reserva,Spanien,red,Muga Reserva,Spanien,red
8729,0.019792519531631317,80_left,2180_right,PRÀ Morandina Valpolicella Ripasso,Italien,red,Bertani Valpolicella Ripasso,Italien,red
17144,0.019251565251079163,182_left,1775_right,DISSENAY Chardonnay,Frankreich,white,Laroche Chardonnay,Frankreich,white
13984,0.019251565251079163,145_left,1775_right,FONFILE Chardonnay,Frankreich,white,Laroche Chardonnay,Frankreich,white
22831,0.017518800253169407,253_left,988_right,"GRANS Trittenheimer Apotheke 0,375 L",Deutschland,white,Ansgar Clüsserath Trittenheimer Apotheke Riesling Trocken,Deutschland,white
0,0.017338319844012063,0_left,7576_right,LE TAPIE Rouge,Frankreich,red,Domaine Bassac Le Manpôt Rouge,Frankreich,red
18764,0.011922285757545727,199_left,7209_right,WALCH - von Keller Weißburgunder,Italien,white,Van Volxem Weissburgunder,Deutschland,white
13261,0.008812525188005377,132_left,2434_right,PIRRAMIMMA Classic Shiraz,Australien,red,Heartland Shiraz,Australien,red
4881,0.008755524721571864,37_left,4765_right,CIGALUS Rouge,Frankreich,red,Domaine Montrose Rouge,Frankreich,red
17608,0.006165759720303292,188_left,11083_right,SOLIGO L'Arcata Prosecco Frizzante,Italien,white,San Simone Prosecco Frizzante,Italien,sparkling
11588,0.004142360687991952,113_left,65_right,THE GREAT TINTO 1 Liter,Spanien,red,Casa Rojo Alexander (The Great),Spanien,red
22729,0.0011350022112562748,251_left,3006_right,GRANS-FASSIAN Laurentiuslay GG,Deutschland,white,Grans-Fassian Apotheke Riesling GG VDP. Grosse Lage,Deutschland,white
5088,-0.007329125699625445,40_left,9920_right,CHÂTEAU DES FINES ROCHES,Frankreich,red,Domaine des Roches Neuves Bulles de Roche,Frankreich,sparkling
16076,-0.010017218837968472,168_left,5377_right,LURTON Diane Sauvignon Blanc,Frankreich,white,Le Val Sauvignon Blanc,Frankreich,white
22123,-0.01151068167065788,243_left,2450_right,SONNENHOF Grande Réserve,Deutschland,white,DiamAndes Grande Réserve,Argentinien,red
22013,-0.016528242762731037,241_left,5120_right,BRENNFLECK Sylvaner,Deutschland,white,Stefan Vetter Sylvaner,Deutschland,white
15961,-0.018188848006517603,166_left,5374_right,VIEIL ARMAND Gewurztraminer,Frankreich,white,Wolfberger Gewurztraminer Alsace,Frankreich,white
19526,-0.02167873601039241,207_left,2072_right,VAL DO SOSEGO Albariño,Spanien,white,Fefiñanes Albariño de Fefiñanes,Spanien,white
9579,-0.022278045154780306,89_left,12330_right,VECCHIA TORRE Syrah Primitivo,Italien,red,Vecchia Torre Leverano Rosato,Italien,rosé
13311,-0.02516289132234058,133_left,11007_right,BLEASDALE Frank Potts,Australien,red,Bleasdale Sparkling Shiraz,Australien,sparkling
2829,-0.02625614073135938,20_left,9978_right,CHÂTEAU BONNET Réserve,Frankreich,red,Alexandre Bonnet Grande Réserve Brut Champagne,Frankreich,sparkling
7350,-0.03340013468014031,64_left,7871_right,PASQUA Valpolicella,Italien,red,Pasqua Vigneti e Cantine Amarone della Valpolicella,Italien,red
23461,-0.03378335796193968,267_left,4146_right,PFAFFL Zeisen,Österreich,white,Weingut R&A Pfaffl Grüner Veltliner ZEISEN Weinviertel DAC,Österreich,white
15734,-0.0338701527636434,165_left,2806_right,DOMAINE DE REUILLY,Frankreich,white,Domaine de Fondrèche Nature,Frankreich,red
15378,-0.039261557902436364,163_left,1601_right,Ferrandière Grand Vin Blanc,Frankreich,white,Château l'Hospitalet Grand Vin La Clape Blanc,Frankreich,white
1201,-0.041472748320228174,9_left,2447_right,LES ORMIÈRES,Frankreich,red,Les Jamelles Merlot,Frankreich,red
5312,-0.04150788117305349,42_left,1158_right,CHÂTEAU MARZY,Frankreich,red,Château Malbec Bordeaux,Frankreich,red
3468,-0.04150788117305349,24_left,1158_right,CHÂTEAU PLAISANCE,Frankreich,red,Château Malbec Bordeaux,Frankreich,red
21293,-0.04562961760905538,231_left,1179_right,WILLEMS-WILLEMS Rosenberg,Deutschland,white,Markowitsch Rosenberg,Österreich,red
761,-0.047567994522556535,7_left,5731_right,DOMAINE DE GRANGENEUVE L'Initiale H,Frankreich,red,Domaine de l'Horizon Rouge,Frankreich,red
